title	link	date	author	text	comment_rbloggers
Network of People who Twitter about R	https://www.r-bloggers.com/2009/11/network-of-people-who-twitter-about-r/	November 7, 2009	Drew Conway	On Tuesday I will be speaking to the Bay Area R group about doing social network analysis in R with igraph.  During the talk I will (hopefully) be doing some live SNA on the audience using R and generating data via Twitter.  As a  preview, or small taste for those not able to attend, I have generated network data from the last 100 tweets—as of yesterday afternoon—that included the hash-tag #rstats. The figure below is the 2-core of the full network.  As you might imagine, the full network is quite large, but the vast majority of nodes are pendants; therefore, visualizing the 2-core is much more useful.  Those that twittered with #rstats are in red and labeled, while all of the intervening nodes are in blue.  I am a bit of a wallflower in this crowd, but I am a relative newcomer to both Twitter and R so this makes sense.  You can see that powerhouse gurus like @CMastication, @revodavid, @dataspora, @hamiltonulmer, etc. are very central.  Also, this visualization nicely depicts the size and connectedness of the R community on Twitter. For example, the network contains only 181 nodes  and has a diameter of 7.  On the other hand, there are several disparate cliques around the central actors (e.g., @gappy3000 and myself form a small clique). I look forward to digging further into the Twitter data on Tuesday, and if you are attending and have any suggestion or specific questions please let me know and I will try to work them in. 	 0 Comments
PMML and Open Source Data Mining	https://www.r-bloggers.com/2009/11/pmml-and-open-source-data-mining/	November 6, 2009	Alex Guazzelli		 0 Comments
R Tutorial Series: Zero-Order Correlations	https://www.r-bloggers.com/2009/11/r-tutorial-series-zero-order-correlations/	November 6, 2009	John M. Quick	One of the most common and basic techniques for analyzing the relationships between variables is zero-order correlation. This tutorial will explore the ways in which R can be used to employ this method. Before we start, you may want to download the sample data (.csv) used in this tutorial. Be sure to right-click and save the file to your R working directory. This dataset contains pre and post test scores for 66 subjects on a series of reading comprehension tests (Moore & McCabe, 1989). Note that all code samples in this tutorial assume that this data has already been read into an R variable and has been attached. The most fundamental way to calculate correlations is to directly operate on two variables. In R, this can be done using the cor() function. The cor() function accepts the following arguments (“Correlation, Variance…”, n.d.). In most cases, x and y are the only arguments that you will use when running the cor() function. The basic format for calculating a correlation is cor(VAR1, VAR2), where VAR1 and VAR2 are the variables that you would like to correlate. Suppose that our research question is: “How does a subject’s pretest 1 score relate to his or her posttest 1 score?” The following example demonstrates how to use the cor() function to calculate the correlation between pretest 1 (PRE1) and posttest 1 (POST1). When beginning to analyze a dataset, researchers often want to get a complete picture of all correlations, rather than just a single one. Conveniently, the cor() function can also be run on an entire set of data. The format for this operation is cor(DATAVAR), where DATAVAR is the name of the R variable containing the data. Suppose now that our research question is: “How do all of the test scores in the dataset relate to each other?” The following example demonstrates how to use the cor() function to calculate all of the correlations in a dataset. The output of the preceding function is pictured below.  To see a complete example of how correlational analysis can be conducted in R, please download the correlational analysis example (.txt) file.  Correlation, Variance and Covariance (Matrices). (n.d.). Retrieved October, 27, 2009 from http://sekhon.berkeley.edu/stats/html/cor.html Moore, D., and McCabe, G. (1989). Introduction to the practice of statistics [Data File]. Retrieved October, 27, 2009 from http://lib.stat.cmu.edu/DASL/Datafiles/ReadingTestScores.html 	 0 Comments
Creating scatter plots using ggplot2	https://www.r-bloggers.com/2009/11/creating-scatter-plots-using-ggplot2/	November 6, 2009	Ralph	The ggplot2 package can be used as an alternative to lattice for producing high quality graphics in R. The package provides a framework and hopefully simple interface to producing graphs and is inspired by the grammar of graphics. The main function for producing graphs in this package is qplot, which stands for quick plot. The first two arguments to the function are the name of objects that contain the x and y variables for the plot that is being created. Like many functions in R there is a data argument that can be used to specify a data frame to look in for the variables. As a first example we create a scatterplot of age and circumference for the data set in R that has measurements of the growth of Orange trees. The code to produce this graph is very simple and is shown below: This produces the following graph: Scatterplot Example 1 The main thing with this graph is that we are ignoring the different trees and looking at the overall trend. If we want to distinguish between the growth for the trees separately we can use different colours for the plotting symbols and add a legend to indicate which colour corresponds to a given tree. The colour argument is used to specify a variable and qplot will automatically created a legend based on the levels of this categorical variable. We adjust our code to be: and the graph now looks like: Scatterplot Example 2 That is a nice improvement on the initial graph as we can visually compare the growth trends for the five trees. We can build additional elements into our graph, such as adding a smoother to show a trend, by making use of the geom argument which is used to specify what type of display is being created. The package has a nice feat that allows us to specify a vector with multiple elements to build up additional elements to the graph. We can add a smoother to the original plot with the code below: This produces the following graph: Scatterplot Example 3 An alternative would be to change from plotting with symbols to joining the points with lines. This change again makes use of the geom argument as follows: The graph now looks like: Scatterplot Example 4 with a separate coloured line for each tree. 	 0 Comments
Top Five Open Source Projects of 2009	https://www.r-bloggers.com/2009/11/top-five-open-source-projects-of-2009/	November 5, 2009	Ed Borasky		 0 Comments
opentick alternatives	https://www.r-bloggers.com/2009/11/opentick-alternatives/	November 5, 2009	Joshua Ulrich	"
 "	 0 Comments
R has a JSON package	https://www.r-bloggers.com/2009/11/r-has-a-json-package/	November 5, 2009	nsaunders	Named rjson, appropriately.  It’s quite basic just now, but contains methods for interconversion between R objects and JSON.  Something like this: Use cases?  I wonder if RApache could be used to build an API that serves R data in JSON format? 	 0 Comments
Show me the mean(ing)…	https://www.r-bloggers.com/2009/11/show-me-the-meaning%e2%80%a6/	November 5, 2009	Manos Parzakonis	Well testing a bunch of samples for the largest population mean isn’t that common yet a simple test is at hand. Under the obvious title “The rank sum maximum test for the largest K population means” the test relies on the calculation of the sum of ranks under the combined sample of size , where  is the common size of the k’s samples. For illustration purposes the following data are used. They consist of 6 samples of 5 observations. Next we construct a convenient matrix and we compute the sample ranks So we would test whether the 4th sample has the largest population mean. First we need critical values. So, we cannot accept the hypothesis of the largest mean for the 4th sample. Look it up… Gopal K. Kanji, 100 Statistical Tests , Sage Publications [google] 	 0 Comments
Scivews-K got updated again	https://www.r-bloggers.com/2009/11/scivews-k-got-updated-again/	November 4, 2009	Shige		 0 Comments
R’s xtabs for total weighted read coverage	https://www.r-bloggers.com/2009/11/rs-xtabs-for-total-weighted-read-coverage/	November 4, 2009	Jeremy Leipzig		 0 Comments
Split, apply, and combine in R using PLYR	https://www.r-bloggers.com/2009/11/split-apply-and-combine-in-r-using-plyr/	November 4, 2009	Stephen Turner		 0 Comments
LondonR tomorrow night	https://www.r-bloggers.com/2009/11/londonr-tomorrow-night/	November 2, 2009	mikeksmith's posterous	"
 LondonR Date:  Tuesday 3rd November Time: 6pm  – 9.30pm Venue: Shooting Star Public house,  129    City Rd London, EC1, United Kingdom +44 20 7929 6818 Introduction: Richard Pugh – mangosolutions To   register, for more information or to speak at the next LondonR meeting please email us The presentations from the last events are available here. Click here to register on the London R mailing list I’m heading to the LondonR meeting tomorrow night at the Shooting Star pub (E1) hosted by Mango Solutions. It’ll be interesting to hear how folks from industries other than the Pharma world are using R. BTW – the address for the pub is a little misleading. We think it’s this one: Shooting Star, Liverpool St E1 7JF Permalink 

	| Leave a comment  »
 "	 0 Comments
Welsh test by permutations	https://www.r-bloggers.com/2009/11/welsh-test-by-permutations/	November 1, 2009	Timothée Poisot		 0 Comments
R Tutorial Series: Summary and Descriptive Statistics	https://www.r-bloggers.com/2009/11/r-tutorial-series-summary-and-descriptive-statistics/	November 1, 2009	John M. Quick	"Summary (or descriptive) statistics are the first figures used to represent nearly every dataset. They also form the foundation for much more complicated computations and analyses. Thus, in spite of being composed of simple methods, they are essential to the analysis process. This tutorial will explore the ways in which R can be used to calculate summary statistics, including the mean, standard deviation, range, and percentiles. Also introduced is the summary function, which is one of the most useful tools in the R set of commands. Before we start, you may want to download the sample data (.csv) used in this tutorial. Be sure to right-click and save the file to your R working directory. This dataset contains hypothetical age and income data for 20 subjects. Note that all code samples in this tutorial assume that this data has already been read into an R variable and has been attached. In R, a mean can be calculated on an isolated variable via the mean(VAR) command, where VAR is the name of the variable whose mean you wish to compute. Alternatively, a mean can be calculated for each of the variables in a dataset by using the mean(DATAVAR) command, where DATAVAR is the name of the variable containing the data. The code sample below demonstrates both uses of the mean function. Within R, standard deviations are calculated in the same way as means. The standard deviation of a single variable can be computed with the sd(VAR) command, where VAR is the name of the variable whose standard deviation you wish to retrieve. Similarly, a standard deviation can be calculated for each of the variables in a dataset by using the sd(DATAVAR) command, where DATAVAR is the name of the variable containing the data. The code sample below demonstrates both uses of the standard deviation function. Keeping with the pattern, a minimum can be computed on a single variable using the min(VAR) command. The maximum, via max(VAR), operates identically. However, in contrast to the mean and standard deviation functions, min(DATAVAR) or max(DATAVAR) will retrieve the minimum or maximum value from the entire dataset, not from each individual variable. Therefore, it is recommended that minimums and maximums be calculated on individual variables, rather than entire datasets, in order to produce more useful information. The sample code below demonstrates the use of the min and max functions. The range of a particular variable, that is, its maximum and minimum, can be retrieved using the range(VAR) command. As with the min and max functions, using range(DATAVAR) is not very useful, since it considers the entire dataset, rather than each individual variable. Consequently, it is recommended that ranges also be computed on individual variables. This operation is demonstrated in the following code sample. Given a dataset and a desired percentile, a corresponding value can be found using the quantile(VAR, c(PROB1, PROB2,…)) command. Here, VAR refers to the variable name and PROB1, PROB2, etc., relate to probability values. The probabilities must be between 0 and 1, therefore making them equivalent to decimal versions of the desired percentiles (i.e. 50% = 0.5). The following example shows how this function can be used to find the data value that corresponds to a desired percentile.  Note that quantile(VAR) command can also be used. When probabilities are not specified, the function will default to computing the 0, 25, 50, 75, and 100 percentile values, as shown in the following example. In the opposite situation, where a percentile rank corresponding to a given value is needed, one has to devise a custom method. To begin, consider the steps involved in calculating a percentile rank. From the preceding steps, the formula for calculating a percentile rank can be derived: percentile rank = length(VAR[VAR <= VAL]) / length(VAR) * 100, where VAR is the name of the variable and VAL is the given value. This formula makes use of the length function in two variations. The first, length(VAR[VAR <= VAL]), counts the number of data points in a variable that are below the given value. Note that the ""<="" operator can be replaced with other combinations of the , and = operators, supposing that the function were to be applied to different scenarios. The second, length(VAR), counts the total number of data points in the variable. Together, they accomplish steps one and two of the percentile rank computation process. The final step is to multiply the result of the division by 100 to transform the decimal value into a percentage. A sample percentile rank calculation is demonstrated below. A very useful multipurpose function in R is summary(X), where X can be one of any number of objects, including datasets, variables, and linear models, just to name a few. When used, the command provides summary data related to the individual object that was fed into it. Thus, the summary function has different outputs depending on what kind of object it takes as an argument. Besides being widely applicable, this method is valuable because it often provides exactly what is needed in terms of summary statistics. A couple examples of how summary(X) can be used are displayed in the following code sample. I encourage you to use the summary command often when exploring ways to analyze your data in R. This function will be revisited throughout the R Tutorial Series. The output of the preceding summary is pictured below.  The output of the preceding summary is pictured below.  To see a complete example of how summary statistics can be used to analyze data in R, please download the summary statistics analysis example (.txt) file. Thank you for participating in the Summary and Descriptive Statistics tutorial. I hope that it has been useful to your work with R and statistics. Please let me know of any feedback, questions, or requests that you have in the comments section of this article. Our next guide will be on the topic of Zero-Order Correlations. "	 0 Comments
Happy New Year with R	https://www.r-bloggers.com/2009/12/happy-new-year-with-r/	December 31, 2009	Yihui Xie	I have to admit that the previous post on Christmas is actually not much fun. Today I received another pResent from Yixuan which is more interesting:  Basically the code deals with letter polygons (i.e. glyphs) and plot them with proper projections from 3D to 2D space: Thanks, Yixuan! By the way, there are even more interesting demos in the fun package, just install the package by install.packages('fun', repos = 'http://r-forge.r-project.org') to see demo(package = 'fun')$results[, 'Item']. 	 0 Comments
Updates about R-bloggers, a Happy new year, and one request	https://www.r-bloggers.com/2009/12/updates-about-r-bloggers-a-happy-new-year-and-one-request/	December 31, 2009	Tal Galili		 0 Comments
Because it’s Friday: The inner life of a cell	https://www.r-bloggers.com/2009/12/because-its-friday-the-inner-life-of-a-cell/	December 31, 2009	David Smith	Happy New Year, everyone. In celebration of the New Year, enjoy this celebration of the workings of life from Harvard University.   More at the link below: 3 Quarks Daily: The inner life of the cell 	 0 Comments
R/Finance 2010, April 16-17 in Chicago	https://www.r-bloggers.com/2009/12/rfinance-2010-april-16-17-in-chicago/	December 31, 2009	David Smith	Today is the last day to submit abstracts for the R/Finance 2010 conference to be held in Chicago on April 16-17. If you’re not planning on speaking, but are interested in applications of R in Finance, be sure to add this to your calendar — last year’s conference was an outstanding event. Here’s some more information about the conference from the website: The two-day conference will cover topics including portfolio management, time series analysis, advanced risk tools, high-performance computing, and econometrics. All will be discussed within the context of using R as a primary tool for financial risk management and trading. We strongly encourage R users, as well as package authors to submit an abstract for presentation at this years conference. The 2010 conference will build upon the success of last year’s event. Including traditional keynotes from leading names in the R and finance community, presentation of contributed papers, short “lightning-style” presentations as well as the chance to meet and discuss colloboratively the future of the R in Finance community. R/Finance 2010: Applied Finance with R 	 0 Comments
R in the NYT	https://www.r-bloggers.com/2009/12/r-in-the-nyt/	December 30, 2009	Ethan Fosse		 0 Comments
Brief Analysis of Abdulmutallab (Christmas Day bomber) Web Posting Data	https://www.r-bloggers.com/2009/12/brief-analysis-of-abdulmutallab-christmas-day-bomber-web-posting-data/	December 30, 2009	Drew Conway	Thanks to Evan Kohlman at the NEFA Foundation for compiling, and Danger Room for publicizing, the data set of all of Farouk Abdulmutallab’s posts to the Islamic Forum on Gawaher.com.  Since Evan took the initiative to download and save the  raw HTML data, I thought it would be useful to go one step further and parse it into a more useable (analyzable?) format.  With a little work in Python and html5lib I was able to convert the HTML into a long comma-delimited file with observation data for post date, time, title, contents, number of views, and number of replies. With this new data set I did some arm-chair analysis to see what—if any—interesting could be found.  Using R along with ggplot2 I generated several visualizations that contain some notable observations.  As I sure you are eager to get your hands on the data, I will say before moving on that the CSV file can be downloaded at the ZIA Code Repository along with an R file used to generate the visualizations and analysis after the jump. UPDATE: The intrepid Michael Bommarito of Computational Legal Studies took it one step further, and downloaded and parsed all of Abdulmutallab’s postings and correspondences on the web forum.  More data for the hungry masses, thanks Mike!  First, I am not one for content analysis, but friend and R expert Josh Reich pulled the data and created a nice Wordle of Abdulmutallab’s posts.  Some interesting things here, notably the prominence of words like “think,” “help,” and “want.”  Rather than look at the posts themselves, I was interested in the activity; and as such I begin with a histogram of his postings over the time perdiod. Other than having a very approximate seasonal tendency with two peaks, it is difficult to claim that Abdulmutallab’s posting density followed any strict pattern.  Instead, at this binning (every 30 days from the first post, ignore the date label–they are wrong) it appears his activity came in ebbs and flows.  Given this bustiness may be useful to also examine the popularity of Abdulmutallab’s posts.  Although we have no benchmark for mean post popularity on Gawaher.com, we can examine within the sample.  Below is a scatter plot of his post’s views versus replies, with points sized and colored by the ratio of replies to views. This data is quite skewed, so logs were taken, and from this we can see the relationship is rather linear.  There are; however, several notable posts that receive nearly one reply for every two views (large red points).  For the final analysis I combine both time and activity to see if there were any periods where Abdulmutallab received notably high attention from forum users.  The plot below shows his post’s view and reply counts in chronological order.  Two interesting observation from this visualzation.  First, while the previous plot indicates that several posts receive a high ratio of replies to views, this plot shows that these high ratio posts are not the most popular.  In fact, the most popular posts (by view count) have relatively few replies, and all happen within a short time span.  This latter observations is most interesting, as clearly Abdulmutallab was writing on something very interesting to the Gawaher.com audience during this span.  The next step would be to go back into the data, examine that time period and analyze the posts’ content. Another idea would be to create a model to examine if lagged number of replies predicted length or content of a post.  There may also be something interesting to say about the content of a post’s title and the how that attracts users.  Unfortunately, without the content of those replies and only the count it is hard to determine what the relationship is. What are your ideas? Photo: Danger Room 	 0 Comments
Use plyr instead of _apply() in R	https://www.r-bloggers.com/2009/12/use-plyr-instead-of-_apply-in-r/	December 30, 2009	Stephen Turner		 0 Comments
What’s up with Darwin’s weather?	https://www.r-bloggers.com/2009/12/whats-up-with-darwins-weather/	December 30, 2009	David Smith	Darwin is a the capital city of Australia’s Northern Territory. Lying on the coast of far Northern Australia, it’s situated well in the tropics and as a result has hot, steamy, monsoonal weather. Darwin’s weather has already had impact on urban culture, and now it seems it’s had a political impact too: it’s been at in the middle of the recent “Climategate” “scandal”. A climate-change skeptic observed a discontinuity in the raw temperature records at Darwin airport in 1942 (which, as it turned out, was caused by a change in the equipment), and claimed that the standardization of the data was an overt attempt to present a cooling trend as a warming trend. This claim was roundly denounced in The Economist (prompting yet another reply and rebuttal). Matthew Markus wasn’t satisfied with drawing conclusions from a back-and-forth in the blogosphere, though. He decided to get hold of the raw data from the Global Historical Climate Network and attempt to reproduce this “smoking gun” graphic for himself in R.   Markus provides all the details and R code for accessing and plotting the temperature data in a blog post. There’s lots of practical advice there, including how use the various command-line tools to uncompress and inspect the data (although you’ll need a Unix-ish machine to follow along) as well as all the R commands for reading in the data. (It makes for a nice demonstration of reading fixed-format data files into R, actually.) You’ll also see how to standardize and plot the data, with a result fairly close to the original above:  Matthew Markus: Raw Darwin Airport Temperature Data with R    	 0 Comments
Top Ten Must-Have R Packages for Social Scientists	https://www.r-bloggers.com/2009/12/top-ten-must-have-r-packages-for-social-scientists/	December 29, 2009	Ethan Fosse		 0 Comments
