title	link	date	author	text	comment_rbloggers
A Handbook of Statistical Analyses Using R – Everitt and Hothorn (2006)	https://www.r-bloggers.com/2009/01/a-handbook-of-statistical-analyses-using-r-everitt-and-hothorn-2006/	January 31, 2009	bryan	 A Handbook of Statistical Analyses Using R addresses a list of several common statistical analyses in great detail.  Over a course of 15 chapters, the handbook takes the reader from an introduction to R through a discussion of statistical inference, to linear and logistic regression, tree analysis, survival analysis, longitudinal analysis, meta-analysis, factoring, scaling, and clustering.  The handbook has a peer-reviewed journal style that will be familiar to academic researchers and each chapter stands on its own.  This approach makes the text exceptionally useful in the academic setting as a professor can distribute and assign the first chapter of the book to her Research Methods 101 course; the final chapters on scaling and dimensionality to her Psychometrics Methods course; the last chapter on clustering to her Marketing Research course; and require the entire book for her graduate methods course.  For custom research shops making the transition to R or who frequently hire new entry level R users, this book will work well as a reference and training manual.   The handbook does show typical first edition flaws.  There are sporadic mistakes in grammar such as misspellings and incorrect words.  The overall organization of the book is strong, but the chapter level organization is less effective.  Each chapter begins with a discussion of all of the datasets used in that chapter and is followed by examples and applications based on those datasets. In chapters where there are several examples, the discussion of the data is too detached from its corresponding example.  When the reader reaches the example based on the first dataset they have likely forgotten the relevant details about that data’s structure.  Grouping the data discussions with the examples they accompanied would have made the example based approach more effective. read more 	 0 Comments
State-of-the-art in parallel computing with R: New paper	https://www.r-bloggers.com/2009/01/state-of-the-art-in-parallel-computing-with-r-new-paper/	January 30, 2009	Thinking inside the box		 0 Comments
Importing Generic Function from Other Package: A Tip on Writing a R Package	https://www.r-bloggers.com/2009/01/importing-generic-function-from-other-package-a-tip-on-writing-a-r-package/	January 30, 2009	Yu-Sung Su		 0 Comments
Visualizing Eigenfactors	https://www.r-bloggers.com/2009/01/visualizing-eigenfactors/	January 30, 2009	John Myles White	These interactive graphics are simply beautiful. And they just so happen to be profoundly informative about the structure of modern science as well. Here’s to the hope that we will see more work from Moritz Stefaner soon that shows how our aesthetic and scientific demands can be met simultaneously. HT to Infosthetics. 	 0 Comments
Runing R in the Command Mode in the Window system	https://www.r-bloggers.com/2009/01/runing-r-in-the-command-mode-in-the-window-system/	January 29, 2009	Yu-Sung Su		 0 Comments
MCMCglmm package for R	https://www.r-bloggers.com/2009/01/mcmcglmm-package-for-r/	January 29, 2009	Gregor Gorjanc		 0 Comments
InDesign: Export Selection to PDF	https://www.r-bloggers.com/2009/01/indesign-export-selection-to-pdf/	January 29, 2009	[email protected]		 0 Comments
Controlling margins and axes with oma and mgp	https://www.r-bloggers.com/2009/01/controlling-margins-and-axes-with-oma-and-mgp/	January 26, 2009	bryan	"When creating graphs, we’re usually most concerned with what happens near the center of our displays, as this is where most of the important information is generally held.  But sometimes, either for aesthetics or clarity, we want to adjust what’s outside of the box – in the margins, labels or tick marks.  The par() function offers several ways to do this and I’ll discuss two that deal primarily with spatial orientation – rather than content – below.

The oma, omd, and omi options read more "	 0 Comments
New CRAN Task View on HPC	https://www.r-bloggers.com/2009/01/new-cran-task-view-on-hpc/	January 24, 2009	Thinking inside the box		 0 Comments
Data Analysis and Graphics Using R – Maindonald and Braun (2003)	https://www.r-bloggers.com/2009/01/data-analysis-and-graphics-using-r-maindonald-and-braun-2003/	January 23, 2009	bryan	 Data Analysis and Graphics Using R (DAAG) covers an exceptionally large range of topics.  Because of the book’s breadth, new and experienced R users alike will find the text helpful as a learning tool and resource, but it will be of most service to those who already have a basic understanding of statistics and the R system. Although the text includes both an Introduction to R section (chapter one) and a discussion of the basics of quantitative data analysis (chapters two through four), these chapters will be most useful as overviews (or reviews for more experienced readers), as they lack the detail required to take a reader from no knowledge of these subjects to a functional understanding.  For example, chapter one discusses importing data in .txt and .csv format, but the foreign package is not discussed until chapter fourteen – the final chapter of the book.  In practice, .txt data structures are not common enough to justify relegating a discussion of the foreign package to the supplemental materials and a researcher stuck with a .sav or .dbf file would not leave chapter one with enough knowledge to import their data into R. read more 	 0 Comments
R Programmer – Calgary	https://www.r-bloggers.com/2009/01/r-programmer-calgary/	January 23, 2009	Programming R	"Originally posted on r-sig-jobs listserv: Hello All, We are in ned of an R programmer for a project in Calgary, Alberta, Canada.  We need the person to be local as the project involves coordination of a series of experts.  The project is only about 150 hours.  The ideal candidate will be an experienced R programmer who is available immediately.  Please contact me for further details or if you know of someone that might be a suitable candidate.  A referral fee of $200 will be given if your referral is chosen. Cheers,
Tyler
[email protected] "	 0 Comments
Install JAGS and rjags in Fedora	https://www.r-bloggers.com/2009/01/install-jags-and-rjags-in-fedora/	January 23, 2009	Yu-Sung Su		 0 Comments
R: Combining vectors or data frames of unequal length into one data frame	https://www.r-bloggers.com/2009/01/r-combining-vectors-or-data-frames-of-unequal-length-into-one-data-frame/	January 23, 2009	markheckmann	Today I will treat a problem I encounter every once in a while. Let’s suppose we have several dataframes or vectors of unequel length but with partly matching column names,  just like the following ones: This for example may occur when fitting several multiple regression models each time using different combination of regressors. Now I would like to combine the results into one data frame.  The merge() as well as the rbind() function do not help here as they require equal lengths. I posted this matter on r-help as my first solution was somewhat awkward and could not be generalized to any data frames or list of data frames. The first solution was posted by Charles C. Berry. myList is a list containing the data frames as elements What he does is to use a nested loop. The inner loop runs for each data frame over each column name. It basically takes each column name and the correponding element [i, j] from the data frame ( myList[[i]] ) and writes it into an empty data frame (dat). Thereby a new column that is named just like the column from the list element data frame is created. The cells that are left out are automatically set NA. Note that the order of the output columns depends on the input order. The list below renders a different order, though it contains the same elements but ordered differently. Another solution was posted by Henrique Dallazuanna. This one has the advantage that it does not use loops. It looks a bit scary at first, so let's examine it starting from the inside. As a next step for each vector with column names all columns are selected leaving those that are not present with NA values. As a last step the vectors having the same columns are combined. The only little flaw in this function is that the column names of the first vector are taken as column names of the developing data frame. Using the second list from above, gives the following. Thus, in a last step we need change the column names of the data frame. Well this works but it would be much more convenient to get this done in one single function and well, since october 2008 there is one. It can be found in the plyr package written by Hadley Wickham. So the solution is as easy as: The results: Now, this is nice! It is really worthwhile having a look at Hadley Wickhams plyr package as it provides a lot of functions that make life a lot easier when it comes to splitting list or data frames, doing a calculation or not and merge them afterwards again. More on that another day. Cheers, Mark 	 0 Comments
Interesting tip about multicolor title of a plot	https://www.r-bloggers.com/2009/01/interesting-tip-about-multicolor-title-of-a-plot/	January 23, 2009	Paolo		 0 Comments
EMBL Heidelberg seeks a Bioinformatician / Data Analyst	https://www.r-bloggers.com/2009/01/embl-heidelberg-seeks-a-bioinformatician-data-analyst/	January 21, 2009	Programming R	Originally posted on r-sig-jobs listserv: Hello, Might be interesting for some of you: Bioinformatician / Data Analyst Grade: 5 or 6, depending on experience EMBL site: EMBL Heidelberg Commencing date: As sooon as possible, after closing date (28 February 2009) read more 	 0 Comments
Vacancy postdoc computational systems biology – Amsterdam	https://www.r-bloggers.com/2009/01/vacancy-postdoc-computational-systems-biology-amsterdam/	January 21, 2009	Programming R	"Originally posted on r-sig-jobs listserv: *Postdoc Position Computational Systems Biology ‘Systems Bioinformatics: Computational Modelling Methods’ f/m
* *
VU University Amsterdam, the Netherlands
* *Research project * read more "	 0 Comments
Sweave.sh plays with weaver	https://www.r-bloggers.com/2009/01/sweave-sh-plays-with-weaver/	January 21, 2009	Gregor Gorjanc		 0 Comments
Customizing R: startup script	https://www.r-bloggers.com/2009/01/customizing-r-startup-script/	January 19, 2009	[email protected]		 0 Comments
Maximum likelihood estimation in R	https://www.r-bloggers.com/2009/01/maximum-likelihood-estimation-in-r/	January 18, 2009	Quantitative Finance Collector		 0 Comments
R vs. SAS	https://www.r-bloggers.com/2009/01/r-vs-sas/	January 17, 2009	martin	Everything started with the article in the NYT talking about R – and of course – did mention SAS. Andrew Gelman picked up the article and posted his take on the matter. Maybe it are sentences like Andrew’s “And it’s good to hear that SAS is in trouble” and Anne H. Milley, director of technology product marketing at SAS: “We have customers who build engines for aircraft. I am happy they are not using freeware when I get on a jet.”, which did stir the readers up.   	 0 Comments
IBrokers Featured on Quantitative Trading	https://www.r-bloggers.com/2009/01/ibrokers-featured-on-quantitative-trading/	January 17, 2009	Joshua Ulrich	"
 "	 0 Comments
Versions of Sweave.sh	https://www.r-bloggers.com/2009/01/versions-of-sweave-sh/	January 16, 2009	Gregor Gorjanc		 0 Comments
Use of include and input in Sweave documents	https://www.r-bloggers.com/2009/01/use-of-include-and-input-in-sweave-documents/	January 16, 2009	Gregor Gorjanc		 0 Comments
Creating R Packages: A Tutorial	https://www.r-bloggers.com/2009/01/creating-r-packages-a-tutorial/	January 16, 2009	Gregor Gorjanc		 0 Comments
littler 0.1.2	https://www.r-bloggers.com/2009/01/littler-0-1-2/	January 14, 2009	Thinking inside the box	"
This version adds two new command-line switches:
 

As usual, our code in our
svn archive, on my r page, and in the
local directory here. A fresh package
is in Debian’s incoming queue, and  Jeff’s
littler page at Vanderbilt should reflect the new release soon too.



 "	 0 Comments
Analyzing Nike+ using R	https://www.r-bloggers.com/2009/01/analyzing-nike-using-r/	January 14, 2009	[email protected]		 0 Comments
Error Bars in R (& other R stuff)	https://www.r-bloggers.com/2009/01/error-bars-in-r-other-r-stuff/	January 14, 2009	Paul Gribble		 0 Comments
R resources for psychologists	https://www.r-bloggers.com/2009/01/r-resources-for-psychologists/	January 12, 2009	Thom Baguley		 0 Comments
R gets some -E-S-P-E-C-T	https://www.r-bloggers.com/2009/01/r-gets-some-e-s-p-e-c-t/	January 12, 2009	dan	NEW YORK TIMES STORY ON THE APPEAL OF R  (click to view movie) It is no secret that Decision Science News is crazy about the R language for statistical computing. Find out why R is so great in this New York Times article. Then start to teach yourself R with our short series of video tutorials. Addendum: Check out the hordes of R supporters in this comments of this Freakonomics blog post, correcting an assumption by Ayers that happens to be 180 degrees in the wrong direction. Animation credit: Friend of Decision Science News Yihui Xie. 	 0 Comments
TextWrangler and R	https://www.r-bloggers.com/2009/01/textwrangler-and-r/	January 10, 2009	[email protected]		 0 Comments
Rcpp 0.6.3	https://www.r-bloggers.com/2009/01/rcpp-0-6-3/	January 9, 2009	Thinking inside the box	" 
This version adds a fix to the OS X installation (thanks to Simon Urbanek),
adds some ‘view-only’ classes for R vectors, matrices and string vectors
(kindly suggested/provided by David Reiss) as well two shorter helper
functions to derive compilation and linker flags for packages using Rcpp.

 "	 0 Comments
Review of R in NYT and GDAT	https://www.r-bloggers.com/2009/01/review-of-r-in-nyt-and-gdat/	January 8, 2009	Neil Gunther		 0 Comments
R in the New York Times (updated)	https://www.r-bloggers.com/2009/01/r-in-the-new-york-times-updated/	January 8, 2009	Paul Gribble		 0 Comments
R-Sessions 30: Visualizing missing values	https://www.r-bloggers.com/2009/01/r-sessions-30-visualizing-missing-values/	January 8, 2009	Rense Nieuwenhuis		 0 Comments
Google Summer of Code 2009	https://www.r-bloggers.com/2009/01/google-summer-of-code-2009/	January 7, 2009	Thinking inside the box		 0 Comments
R featured in New York Times article	https://www.r-bloggers.com/2009/01/r-featured-in-new-york-times-article/	January 7, 2009	Thinking inside the box	"
That’s silly on so many levels. A concise and rather appropriate follow-up came in early from
Frank Harrell,
a long-time S and R advocate:
 
Achim already added this (and two more posts
from the aforementioned threads) to the 
fortunes package that collects such choice quotes.

 
R in Finance (the topic of
our upcoming conference)
gets mentioned as well. Now, as editor of the
Finance task view, I find that second half of
 "	 0 Comments
Forecasting Presidential Elections	https://www.r-bloggers.com/2009/01/forecasting-presidential-elections/	January 7, 2009	John Myles White	Because of Andrew Gelman’s strong, repeated recommendations, I’ve been reading “Forecasting Presidential Elections” by Steven J. Rosenstone for the last two days. It’s quite a remarkable book and complex enough that I’m sure I’ll return to it many times after I’ve finished it. I was particularly intrigued by a table in the first chapter noting the performance of the Gallup poll over the years. The very first Gallup polls were conducted well in advance of the elections, and it seems that Gallup thought that this had been a substantial source of error in his predictions. A review of the data in the aforementioned table, though, makes clear that there is essentially no meaningful relationship between the number of days in advance of the election when the poll was begun and the accuracy of that poll. If one assumes that the Gallup polls were accurate measures of the state of the public’s opinion on the dates when they were conducted, the data suggests that there are years when the public’s electoral decision is decided well in advance of the election and there are other years when the public’s decision is decided almost immediately before the election. To make all of this clear, I graphed the data describing the accuracy of all of the Gallup electoral polls from 1936 to 1980 as a function of how far ahead of the election the poll was conducted. As you can see, there’s virtually no pattern: the light blue line in the chart is the least squares line and the gray line is simply a horizontal line plotted at 0. The least squares line reflects a statistically insignificant correlation of 0.20. Another point that struck me while reading Rosenstone’s book was his discussion of the non-response error of polls. Non-response error is normally explained as the errors in telephone polls caused by those who don’t pick up their phones, those who refuse to be surveyed and those who simply don’t own phones. The first two problems always make sense to me, but I always find myself wondering about the third: how many Americans actually vote in presidential elections who don’t own phones? I’d love to have an answer to that question if anyone has relevant data. 	 0 Comments
New York Times on R	https://www.r-bloggers.com/2009/01/new-york-times-on-r/	January 7, 2009	Gregor Gorjanc		 0 Comments
Combining R and LaTeX with Sweave	https://www.r-bloggers.com/2009/01/combining-r-and-latex-with-sweave/	January 6, 2009	:)-k		 0 Comments
Multiseat setup via Userful	https://www.r-bloggers.com/2009/01/multiseat-setup-via-userful/	January 3, 2009	Thinking inside the box	"
Shortly after Christmas, that computer suffered a catastrophic disk failure (and as an aside, I hate LVM when that
happens…).  So I reinstalled, this time using the Ubuntu rather Kubuntu variant.  This should allow use of
Userful Multiplier
— a commercial multiseat solution with 
free two-seat licenses.
The base package even comes via the Ubuntu repos.

 
I still had a couple of minor issues. One was possibly related to the Radeon card (as in: don’t drive one
monitor in dvi mode and one in analog mode but rather use both in analog mode via a dvi/analog dongle) so the
live cdrom offered by Userful just went into a perpetual ‘reconfigure, reboot, reconfigure, reboot, …’ loop.
Another hitch was that their license manager no longer wanted to use the license key I had requested in
November when I tried in vain to use Userful with KDE. And of course I wouldn’t a new key as the home ip
address hadn’t changed…  Now, with a newly requested key from another IP address, things appear to work at
last using the default Gnome setup — and the kids are back in proper ‘parallel’ use of their workstation.

 
All in all, Userful Multiplier is a nice and useful product especially as long as stock XFree does them the
favour of no longer competing in the basic two-seat case.



 "	 0 Comments
RWinEdt and Windows Vista/Window 7	https://www.r-bloggers.com/2009/01/rwinedt-and-windows-vistawindow-7/	January 1, 2009	Yu-Sung Su		 0 Comments
R/Finance conference in Chicago in April: Call for Papers	https://www.r-bloggers.com/2009/01/rfinance-conference-in-chicago-in-april-call-for-papers/	January 1, 2009	Thinking inside the box	"
 
      The Finance Department of the University of Illinois at Chicago (UIC),
      the International Center for Futures and Derivatives at UIC, and
      members of the R finance community are pleased to announce
       
      R/Finance 2009: Applied Finance with R
       
      on April 24 and 25, 2009, in Chicago, IL, USA
       
      Confirmed keynote speakers include:
       
      Presenters are strongly encouraged to provide working R code to accompany
      the presentation/paper.  Datasets need not be made public.
       
      Please send submissions to [email protected]
      The submission deadline is January 31st, 2009.
      Submissions will be evaluated and submitters notified via email
      on a rolling basis.
       
      Additional details about the conference will be announced as available.
       
      For the program committee:
       "	 0 Comments
Plotting PDQ Output with R	https://www.r-bloggers.com/2009/02/plotting-pdq-output-with-r/	February 27, 2009	Neil Gunther		 0 Comments
R in The Windy City	https://www.r-bloggers.com/2009/02/r-in-the-windy-city/	February 27, 2009	JD Long	"In honor of me moving to Chicago, the powers who abide have decided to hold the first annual “R/Finance conference for applied finance using R” conference in Chicago this year. The dates are April 24-25, 2009. R/Finance 2009: Applied Finance with R To those who made the decision on location, I’m pleased but slightly embarrassed that you let my relocation decision have such a profound impact on your venue choice. And to the three readers that feedburner tells me regularly read this blog (hi Mom), if you are attending this conference please let me know and I’ll buy you a beer or three. -JD 
 "	 0 Comments
Data Analysis Workflow… Part 1 of Infinity	https://www.r-bloggers.com/2009/02/data-analysis-workflow%e2%80%a6-part-1-of-infinity/	February 26, 2009	JD Long	One of the many things that I sit around pondering when I should be doing productive things is the idea of analytical workflow. I have only worked with one analytical guru who I felt really gave thought and structure to workflow and its impact on analyist productivity. When I talk about workflow I mean the whole process from the time the analytical guy thinks, “Hey, I need to understand the velocity of new purchases between different types of sales campaigns.” until he writes down his findings in a presentation or even just a notebook. In the middle I assume this guy extracts some data from a warehouse or live system, does some work on said data, tests some theories, does more stuff, goes and gets coffee, comes back and plays some flash games, goes home and does it again the next day. Today I was reading over at Data Evolution about a presentation on how Google and Facebook use R. The following was a summary of what Bo Cowgill of Google said about his workflow: The typical workflow that Bo thus described for using R was: (i) pulling data with some external tool, (ii) loading it into R, (iii) performing analysis and modeling within R, (iv) implementing a resulting model in Python or C++ for a production environment. I found this interesting as I have been masticating on the idea of learning Python for some time. I have run into situations where R was slow, but generally I have solved those through rethinking my algorithm. I’m not really a good programmer in R (or any other language for that matter), but I do want/need/like the statistical functions and ease of plotting in R. If I do learn Python I’ll certainly use it to call R… but maybe I should just stick to R. This has nothing to do with workflow, but the most thought provoking insights in the article above came from Itamar Rosenn at Facebook: Itamar’s team used recursive partitioning (via the rpart package) to infer that just two data points are significantly predictive of whether a user remains on Facebook: (i) having more than one session as a new user, and (ii) entering basic profile information. … [they also] found that activity at three months was predicted by variables related to three classes of behavior: (i) how often a user was reached out to by others, (ii) frequency of third party application use, and (iii) what Itamar termed “receptiveness” — related to how forthcoming a user was on the site. So Facebook really wants new users to put more info into FB, use it more, and play with third party apps. I guess that logic is why LinkedIn is always telling me I am only 90% complete on my profile and I would be 95% if I would just, yada yada yada… The more info I put into their walled garden, the more I will play there. And the more ads I will see. Makes sense to me. I guess I follow the same model when I try to get my clients to use my services more and more… I want to be sticky too. But not in a bad way. 	 0 Comments
Review of ‘Applied Econometrics in R’ in JSS	https://www.r-bloggers.com/2009/02/review-of-applied-econometrics-in-r-in-jss/	February 25, 2009	Thinking inside the box		 0 Comments
Absolutely great resource	https://www.r-bloggers.com/2009/02/absolutely-great-resource/	February 25, 2009	:)-k		 0 Comments
R/Finance conference in Chicago in April: Registration now open	https://www.r-bloggers.com/2009/02/rfinance-conference-in-chicago-in-april-registration-now-open/	February 23, 2009	Thinking inside the box	"
See you in Chicago in April!

 "	 0 Comments
