title	link	date	author	text	comment_rbloggers
R tips: Installing Rmpi on Fedora Linux	https://www.r-bloggers.com/2009/06/r-tips-installing-rmpi-on-fedora-linux/	June 12, 2009	Allan Engelhardt	"Somebody on the R-help mailing list asked how to get Rmpi working on his Fedora Linux machine so he could do high-performance computing on a cluster of machines (or a single multicore machine) using the R statistical computing and analysis platform.  Since it is unusually painful to get working, I might as well copy the instructions here.
 
First install the openmpi libraries using:
 
The default installation on Fedora still doesn’t quite work, so you need to execute the following command as root (only once is required, after installation of the package):
 
You are not quite done: for R to work right with the libraries, you need to modify the LD_LIBRARY_PATH environment variable to include the path to the Open MPI libraries.  I have the following in my ~/.bash_profile:
 
Edit your file to contain the same, and execute that line at the command prompt and you are ready to continue.
 
Now that your Open MPI libraries are set up, and what you do next depends on what version of Rmpi you are installing.  Most likely you are installing the latest version in which case the following section applies.  The instructions for older versions are retained in a later section for reference.
 
Make sure you have executed the ldconfig command and set the LD_LIBRARY_PATH environment variables as described in the previous section before you continue.
 
Since at least version 0.5-8 of the Rmpi library you can install it from the R command line after you have fixed the Open MPI install.  At the R prompt do:
 
It should work and install OK.  This is obviously quite a mouthful to remember, but help is at hand through the options() mechanism in R.  In your ~/.Rprofile you can add something like:
 Then you can just type install.packages(""Rmpi"") at the R command prompt to install the package.
 
The problem is the configuration file configure.ac which is, unfortunately, completely brain-damaged with hard-coded assumptions about which subdirectories should contain header and library files and no way of overriding it.
 
Download the latest Rmpi package from CRAN and unpack it using tar zxvf Rmpi_0.5-7.tar.gz.  Go to the new Rmpi directory and replace the file configure.ac with the one below (for a x86_64 system; for 32 bit you probably need to change -64 to -32):
 
The number 1.3.1 may change in future releases of Fedora: see /usr/lib64/pkgconfig/openmpi-*.pc for the current value.
 
Still in the Rmpi directory do the following in your shell:
 Now Rmpi should be working in R: Jump to comments. 

Spreadsheet errors
 For my sins, I have done more than my fair share of analysis in Excel. I am quite capable of building and maintaining 130Mb spreadsheets (I had a dozen of them for one client). Excel is pretty much installed everywhere, so it is sometimes the only way to get started getting commercial value of the data in the organisation. But I don’t like it and let’s have a look at one reason why. In order not to always pick on Microsoft, we use another application, but you get the same results with Excel. 

R code for Chapter 1 of Non-Life Insurance Pricing with GLM
 Insurance pricing is backwards and primitive, harking back to an era before computers. One standard (and good) textbook on the topic is Non-Life Insurance Pricing with Generalized Linear Models by Esbjorn Ohlsson and Born Johansson. We have been doing som… 

R code for Chapter 2 of Non-Life Insurance Pricing with GLM
 We continue working our way through the examples, case studies, and exercises of what is affectionately known here as “the two bears book” (Swedish björn = bear) and more formally as Non-Life Insurance Pricing with Generalized Linear Models by Esbjörn Ohl… 

Excel Tip: Array boolean operator
 I learn something new every day. Thinking I knew pretty much everythging there is to know about Microsofts Excel spreadsheet application, I was surprised to see that you could turn any array into a boolean array depending on a condition by simply writing … 

Faster R through better BLAS
 Can we make our analysis using the R statistical computing and analysis platform run faster? Usually the answer is yes, and the best way is to improve your algorithm and variable selection. But recently David Smith was suggesting that a big benefit of the… "	 0 Comments
Simulation of Burning Fire in R	https://www.r-bloggers.com/2009/06/simulation-of-burning-fire-in-r/	June 11, 2009	Yihui Xie	 Simulation of Burning Fire in R And code here: The speed of drawing animation frames is rather slow in my computer, but it doesn’t matter since we can use the animation package (hey, you are advertising!) to save all the image frames and convert them to a single animation file.  Now the animation is much more smooth than what we saw in R graphics window. Thanks, awesome Linlin. 	 0 Comments
Creating Tag Cloud Using R and Flash / JavaScript (SWFObject)	https://www.r-bloggers.com/2009/06/creating-tag-cloud-using-r-and-flash-javascript-swfobject/	June 10, 2009	Yihui Xie	"I recently saw a graph on television that displayed selected words/phrases in a speech scaled in size according to their frequency. So words/phrases that were often used appeared large and words that were rarely used appeared small. […] Marc Schwartz mentioned that Gorjanc Gregor has done some work years ago using R (in grid graphics). The obstacle of creating tag cloud in R, as Gorjanc wrote, lies in deciding the placement of words, and it would be much easier for other applications such as browsers to arrange the texts. That’s true — there have already been a lot of mature programs to deal with tag cloud. One of them is the wp-cumulus plugin for WordPress, which makes use of a Flash object to generate the tag cloud, and it has fantastic 3D rotation effect of the cloud. Before introducing how to port the plugin into R, I’d like to introduce an R function pointLabel() in maptools package and it can partially solve the problem of arranging text labels in a plot (using simulated annealing or genetic algorithm). Here is a simulated example: Simulated Tag Cloud with R function pointLabel() in maptools  I was fortunate to get a very neat graph with no labels overlapping, but I don’t think this is a good solution, as it doesn’t take care of the initial locations of the words. My rough idea about deciding the initial locations is to sample on circles with radii proportional to the frequency, i.e. let  and  where . In this case, important words will be placed near the center of the plot. The problem becomes quite easy with a Flash movie tagcloud.swf and a JavaScript program swfobject.js. The mechanism, briefly speaking, is that the tag information is passed to the Flash object by JavaScript, and the Flash object will read the variable tagcloud where the sizes, colors and hyperlinks of tags are stored. Finally the tags are visualized like rotating cloud. It’s not difficult to pass the tag information to JavaScript in pure text. Below is the function which will create an HTML page by default with a tag cloud Flash movie inside it: The main argument is tagData which is a data.frame containing at least three columns (tag, link and count) and looks like: Additional columns color and hicolor will be used if they exist (hexadecimal numbers specifying RGB), e.g. Here is an example on visualizing my blog tags. You may need the following swf and js files first if you wish the loading would be faster (by default your browser needs to download these two files from roytanck.com first). The above code will generate an HTML page like this:
 
You can adjust the parameters as you wish. There is still one more step to answer Tony’s original question, namely splitting the speech into single words and computing the frequency. This can be (roughly) done by strsplit(..., split = "" "") and table(). Encoding problems may exist in the above code, but URLencode(tagXML) could be of help. Only Latin characters are supported, but there’s possibility to modify the Flash source file to support other languages. See Roy Tanck’s post for more information. Other R resources I know so far: "	 0 Comments
Hack-at-it 2009	https://www.r-bloggers.com/2009/06/hack-at-it-2009/	June 9, 2009	Di Cook		 0 Comments
Data Mashups in R from O’Reilly	https://www.r-bloggers.com/2009/06/data-mashups-in-r-from-oreilly/	June 9, 2009	Allan Engelhardt	"
O’Reilly has published Data Mashups in R as a $4.99 PDF download in their Short Cut series.  In 27 pages it takes you through an example of how to combine foreclosure information with maps and geographical information to produce plots like the one below.  This is all done with the R statistical computing and analysis platform.
 

 
They show how to:
 "	 0 Comments
Two plot with a common legend – base graphics	https://www.r-bloggers.com/2009/06/two-plot-with-a-common-legend-base-graphics/	June 6, 2009	Paolo		 0 Comments
Learning R for Researchers in Psychology	https://www.r-bloggers.com/2009/06/learning-r-for-researchers-in-psychology/	June 6, 2009	Jeromy Anglim		 0 Comments
Elementary Statistics with R	https://www.r-bloggers.com/2009/06/elementary-statistics-with-r/	June 5, 2009	rtutor.chiyau	"

Ever wonder how to finish your statistics homework real fast? Or you just
want a quick way to verify your tedious calculations in your statistics class
assignment. We provide an answer here by solving statistics exercises with
R.
 read more "	 0 Comments
Getting started with R (for german speakers)	https://www.r-bloggers.com/2009/06/getting-started-with-r-for-german-speakers/	June 5, 2009	markheckmann	Just a little note for german speaking R beginners: There is an introductory course in R (german) available online on the website of the department of methodology and evaluation research at the University of Jena. Dr. Ivailo Partchev holds a seven sessions course on that topic (duration 11.5 hours). 	 0 Comments
Twitter from R… Sure, why not!	https://www.r-bloggers.com/2009/06/twitter-from-r%e2%80%a6-sure-why-not/	June 4, 2009	JD Long	"
So I have started following the #RStats tag in twitter. Prior to a week ago I had never Twitterbated so I thought I would give it a go since I am not one to shy away from new technology… much. I think of Twitter like a call in radio show where I get to cut off callers when they annoy me. Well one of the interesting things I ran across was this tweet that pointed to this page about posting tweets from R.  The code example was missing a couple of things, so here’s the cleaned up version: This is a pretty good, and fairly self explanatory example of how to use RCurl to spew out some data. Don’t be a scriptard and try to run this without changing ‘username’ and ‘password.’ If you do, I’m coming to your house and going to beat you with your own keyboard until you admit that I am, indeed, your daddy. Am I planning on Tweeting from R? You have to be kidding. That’s just silly. But I might need to use RCurl again. Although for long running scripts I may very well put code at the end of my scripts that sends out a Tweet when the code has finished running. Waaaay easier than setting up email and trying to ensure it runs from EC2 as well as my home machine, etc. The more I think about that, the more I am sure I’m a friggin genius. And of course, on every one of my script completion tweets I’m going to use the #RStats tag so everyone in twitterland will know that I am amazing. And a prick. All at the same time. I’m complex like that. Oh yeah, I’m @CMastication on Twitter. "	 0 Comments
Check our PMML article – The R Journal	https://www.r-bloggers.com/2009/06/check-our-pmml-article-the-r-journal/	June 3, 2009	Alex Guazzelli		 0 Comments
Use meaningful color schemes in your figures	https://www.r-bloggers.com/2009/06/use-meaningful-color-schemes-in-your-figures/	June 3, 2009	Stephen Turner		 0 Comments
How to plot a graph in R	https://www.r-bloggers.com/2009/06/how-to-plot-a-graph-in-r/	June 2, 2009	Chris	Here’s a quick tutorial on how to get a nice looking graph out of R (aka the R Project for Statistical Computing). Don’t forget that help for any R command can be displayed by typing the question mark followed by the command. For example, to see help on plot, type ?plot. Let’s start with some data from your friends, the Federal Reserve. The fed keeps lots of interesting economic data and they make it pretty easy to get at. What if we’re curious about the value of the US Dollar? How’s it doing against other major currencies? Let’s have a look. I’ll use the Nominal Major Currencies Dollar Index. The fed gives us the data here: First, download the file and load it into your favorite text editor. Replace ss+ with t to create two tab delimited columns. I think this is probably easier than trying to get R to read data separated by at least 2 spaces, as the source file seems to be. Now, load your data into R. R will show you the structure of an object using the str() command: So far so good. R is all about stats, so why not do this? OK, let’s get to some plotting. First off, let’s try a simple case. That’s OK for quickly looking at some data, but doesn’t look that great. R can make reasonable guesses, but creating a nice looking plot usually involves a series of commands to draw each feature of the plot and control how it’s drawn. I’ve found that it’s usually best to start with a stripped down plot, then gradually add stuff. Start out bare-bones. All this does is draw the plot line itself. Next, let’s add the x-axis nicely formatted. We’ll use par(tcl=-0.2) to create minor tick marks. The first axis command draws those, but doesn’t draw labels. The second axis command draws the major tick marks and labels the years on even decades. Note that there’s an R package called Hmisc, which might have made these tick marks easier if I had figured it out. Next, we’ll be lazy and let R decide how to draw the y-axis. I like a grid that helps line your eye up with the axes. There’s a grid command, which seemed to draw grid lines wherever it felt like. So, I gave up on that and just drew my own lines that matched my major tick marks. The trick here is to pass a sequence in as the argument for v or h (for vertical and horizontal lines). That way, you can draw all the lines with one command. Well, OK, two commands. Let’s throw some labels on with the title command. Finally, let’s bust out a linear regression. The lm() function, which fits a linear model to the data, has some truly bizarre syntax using a ~ character. The docs say, “The tilde operator is used to separate the left- and right-hand sides in model formula. Usage: y ~ model.” I don’t get at all how this is an operator. It seems to mean y is a function of model? …maybe? In any case, this works. I’m taking it as voodoo. Now, we have a pretty nice looking plot. The full set of commands is here, for your cutting-and-pasting pleasure. 	 0 Comments
Run a remote R session in emacs: emacs + ESS + R + ssh	https://www.r-bloggers.com/2009/06/run-a-remote-r-session-in-emacs-emacs-ess-r-ssh/	June 1, 2009	Vinh Nguyen	"I don’t know how, but somehow, i stumbled on how to do this. I’ve always used emacs with ESS to run R, since spring 2006 (did it on windows, switched to linux, for years, and most recently, on my macbook).  I liked this because i get the same usual interface across ALL platforms (well, maybe not on an MVS mainframe, but i’ve never even seen R on one of those things).  Plus, i use emacs for everything computery and/or scientific, like using python or code in C (well, i hope to do more of this (do i really hope to?)). Regarding the same interface across all platforms, i use, for example, emacs + ESS + R whenever i remotely log into the ics servers at uci (well, at least anything computationally intensive).  So i ssh into it, fire up emacs, fire up R.  Been doing this since whenever.  Thing is, I usually always write my code on my local computer, and when i’m ready to run the final code, i either run it as a batch script (‘nohup’, and with ‘&’), through the ‘screen’ command (to keep the session runnning when i log out, see my post on R with unix tools), or through emacs.  These days, i’ve been doing it with screen mainly so disconnects to the server won’t interrupt my script. Well, I just found yet another way to do this: write code on local computer, send code to R session easily in emacs (ie not copy and paste).  Oh I remember now, I ran into this by googling ‘emacs ess multiple R session’. Go here, go to section 3.3, ESS on remote computers.  We will need this file.  This site clarified how to get graphics to show. Instruction is as follows. This is super cool huh?!?!  I like!
Alternatively, we can do the same without the ssh.el file.  In emacs, hit ‘M-x shell’.  In this shell, do your ssh -X -C stuff, then run R.  Do ‘M-x ess-remote’ and everything should still work! Next thing to do, with my local emacs, open files that are remote.  this should be easy i think. "	 0 Comments
How to win the KDD Cup Challenge with R and gbm	https://www.r-bloggers.com/2009/06/how-to-win-the-kdd-cup-challenge-with-r-and-gbm/	June 1, 2009	Allan Engelhardt	"
Hugh Miller, the team leader of the winner of the KDD Cup 2009 Slow Challenge (which we wrote about recently) kindly provides more information about how to win this public challenge using the R statistical computing and analysis platform on a laptop (!).
 
As a reminder of what we wrote before, the challenge provided two anonymized data set each of 50,000 mobile teleco customers and each entry having 15,000 variables.  The task was to find the best churn, up-, and cross-sell models.
 
Hugh summarizes his team’s approach:
 
Feature selection was an important first step [we mentioned before that this is key for all successful data mining projects – AE]. We looked at how effective each individual variable was as a predictor, which also allowed us to reading parts of the data only, as the whole dataset didn’t fit in memory [my emphasis – AE]. The assessment here was homebrew, making a simple predictor on half the data and measuring performance (by the AUC measure) on the other half:
 
From this we came up with a set of about 200 variables for each model, which we continued to tinker with. The main model was a gradient boosted machine which used the “gbm” package in R. This basically fits a series of small decision trees, up-weighting the observations that are predicted poorly at each iteration. We used Bernoulli loss and also up-weighted the “1” response class. A fair amount of time was spent optimising the number of trees, how big they should be etc, but a fit of 5,000 trees only took a bit over an hour to fit. The package itself is quite powerful as it gives some useful diagnostics such as relative variable importance, allowing us to exclude some and include others.
 
We used trees to avoid doing much data cleaning – they automatically allow for extreme results, non-linearity, missing values and handle both categorical and continuous variables. The main adjustment we had to make was to aggregate the smaller categories in the categorical variables, as they tended to distort the fits.
 
They did this on standard Windows laptops (Intel Core 2 Duo 2.66GHz processor, 2GB RAM, 120Gb hard drive) against a competition that had more computing clusters available than Imelda Marcos had shoes.  It is not what you’ve got, it’s how you use it 🙂.
 
Congratulations to Hugh and his team!
 Jump to comments. 

R used by KDD 2009 cup winner of slow challenge
 The results from the KDD Cup 2009 challenge (which we wrote about before) are in, and the winner of the slow challenge used the R statistical computing and analysis platform for their winning submission. "	 0 Comments
Simple visualization of a 11X5 table (for WordPress 2.9 Features Vote Results)	https://www.r-bloggers.com/2009/07/simple-visualization-of-a-11x5-table-for-wordpress-2-9-features-vote-results/	July 31, 2009	Tal Galili	" I guess this is not the number one post I would like to start with on this blog, but I feel the time is right for it (community-wise). I’ll move on to the subject matter in a moment, but first a short intro: This blog is written by Tal Galili. I am an aspiring statistician who also loves to use R for his work. At the same time I am also a WordPress blogger, writing mainly at www.TalGalili.com where I can use my native language (Hebrew) for self expression. This combination of statistics and blogging will lead me to sometimes much less statistical, but more Web/Open-Source oriented posts like this one. So for the statisticians in the audience I extend my apologies and invite you to wait for future posts which will be more fully focused on Statistics and R. And now for the topic at hand. . . *         *         *         *         *
I have just noticed the nice article published on the wordpress development blog titled “2.9 Features Vote Results“. The post exemplifies a wonderful trend in the WordPress community (led by Jane Wells) having to do with connecting between the core team and the WordPress user community. The way Jane does this is by giving surveys to WordPress users,  which in turn offers the WordPress core team an opportunity to understand the community needs. In the post “2.9 Features Vote Results“, Jane presented the results of such survey. The post had tables and barplots, but the barplots were only present for the one dimensional variables. In contrast, more elaborate data, such as that of question 2 (asking to rate each of 11 potential features on a scale of 1 to 5), was shown only with a table, such as this:  The table gives the full information (although I would love it if it was easily downloadable, instead of having to type in the numbers) – but its main limitation is that from a quick look, one can not easily get (let alone understand) anything. For the goal of understanding more of the results with a quick glance, I offer two simple and well-known visualizations for the results. 1) Parallel barplots (click for bigger image)  This plot can be easily implemented in Excel (although I did it in R) and can allow us to compare the different ranking each potential feature received. For example, this shows us that most answers were usually given rank 4 (”would be nice”) for each feature. 2) Mosaic plot (click for bigger image)  I don’t know if this can be done in Excel, but with R it is just a simple line of code. (mosaicplot((DataSet.table), las = 1, col = c(”gray”,”gray”,”blue”,3,”dark green”), main = “”)) The advantage of this plot is that it allows us to compare the different features easily, while not only comparing the top rank, but also combining different rankings for easy comparison (for example, comparing how many rank 4 or 5 each feature received). So for example, the plot shows me that the most ranked with number 5 was the feature “easier embeds” but the most ranked “number 4 or 5″ was the feature “custom image sizes”. The feature “media album” came close to these two, but didn’t top either. Conclusions from this post: p.s. to Jane – why do none of the numbers in this table add up to 3406 (the number of respondants) ? p.p.s.  to Jane and the Dev team – great work people! "	 0 Comments
Kruskal-Wallis one-way analysis of variance	https://www.r-bloggers.com/2009/07/kruskal-wallis-one-way-analysis-of-variance/	July 31, 2009	Todos Logos		 0 Comments
Analysis of variance: ANOVA, for multiple comparisons	https://www.r-bloggers.com/2009/07/analysis-of-variance-anova-for-multiple-comparisons/	July 30, 2009	Todos Logos		 0 Comments
Comparison of two proportions: parametric (Z-test) and non-parametric (chi-squared) methods	https://www.r-bloggers.com/2009/07/comparison-of-two-proportions-parametric-z-test-and-non-parametric-chi-squared-methods/	July 29, 2009	Todos Logos		 0 Comments
Wilcoxon signed rank test	https://www.r-bloggers.com/2009/07/wilcoxon-signed-rank-test/	July 29, 2009	Todos Logos		 0 Comments
Beta Verson of tikzDevice Released!	https://www.r-bloggers.com/2009/07/beta-verson-of-tikzdevice-released/	July 28, 2009	cameron	The tikzDevice package provides a new graphics device for R which enables direct output of graphics in a LaTeX-friendly way. The device output consists of files containing instructions for the TikZ graphics language and may be imported directly into LaTeX documents using the \input{} command. The beta version of tikzDevice is now available here. An additional location for downloading source tarballs and windows binaries is here. There are many significant improvements compared to the alpha version: The device requires a working installation of LaTeX and the TIkZ package in order to function. This is because font metrics are currently calculated through direct calls to the LaTeX compiler. Unfortunately, this results in some significant computational overhead- it may take several seconds to create a plot that contains a lot of text. In an attempt to offset this behavior, the tikzDevice uses the filehash package to store font metrics that it has already computed. Hopefully the more the device is used, the faster it will be. We suggest reviewing the package vignette, especially the section “R Options That Affect Package Behavior ” for more information on how the caching process works. We think the package is quite usable as it is, but there are surely many bugs that we don’t know about. We welcome bug reports at our R-Forge tracker Enjoy! The tikzDevice Team 	 0 Comments
