title	link	date	author	text	comment_rbloggers
New material on the GGobi book web page	https://www.r-bloggers.com/2008/01/new-material-on-the-ggobi-book-web-page/	January 30, 2008	Di Cook		 0 Comments
The hammer, or the sledgehammer? A small study in simulation	https://www.r-bloggers.com/2008/01/the-hammer-or-the-sledgehammer-a-small-study-in-simulation/	January 29, 2008	John Johnson		 0 Comments
Shading overlapping area of curves in R	https://www.r-bloggers.com/2008/01/shading-overlapping-area-of-curves-in-r/	January 28, 2008	Yu-Sung Su		 0 Comments
Heuristics for statistics	https://www.r-bloggers.com/2008/01/heuristics-for-statistics/	January 28, 2008	dan	SIMPLE WAYS TO DETECT AND COMMUNICATE STATISTICAL EFFECTS  Decision Science News is fond of heuristics and the Simonian view that for many problems organisms face, optimization is a fiction and satisficing makes us smart.  Statistics is an area in which it is easy to see precision that isn’t there and find “optima” in problems that lack them.  It can be refreshing to look at a problem in a simplified form to get a feeling for what is going on before obsessing over insignificant digits. Andrew Gelman is previewing a few working papers on rules of thumb that make it easy to detect and communicate statistical effects. “Recommended reading,” says Decision Science News, quoting itself. Mini Talk on Simple Statistical Methods Splitting a predictor at the upper quarter or third and the lower quarter or third Scaling regression inputs by dividing by two standard deviations Photo credit: http://www.flickr.com/photo_zoom.gne?id=327299636 	 0 Comments
Hack-at-it 2007	https://www.r-bloggers.com/2008/01/hack-at-it-2007/	January 28, 2008	Di Cook		 0 Comments
ERGMs in R	https://www.r-bloggers.com/2008/01/ergms-in-r/	January 23, 2008	Michal	Developers of statnet, a collection of packages for R for fitting Exponential Random Graph Models (ERGM), issued a major update. First change is that the main package is now called ergm. Secondly, a set of additional packages has been made available. Apart from package network, that provides a class system for relational data on which statnet relies, there are couple of new ones, for example rSonia and dynamicnetwork facilitating work with the SONIA visualizer of network dynamics, but also many more. And, last but not least, thirdly, (almost) all of them are now available on CRAN websites. Another interesting news is the forthcoming special issue of Journal of Statistical Software which is going to be devoted to these new developments. Preliminary versions of the articles are already available on statnet website. I especially welcome the paper by Carter Butts that throughly explains the functionality of the network package that has been available already for some time, but scarce on-line documentation made the conscious use very difficult. 	 0 Comments
Resources for S4 classes and methods	https://www.r-bloggers.com/2008/01/resources-for-s4-classes-and-methods/	January 23, 2008	Michal	"Learning the programming in the new S4 system of classes and methods in R can be quite cumbersome, even though the methods package is very well documented. That is why I collected some of the info and materials that I am aware of on a separate page here. I warmly welcome any suggestions for extending this, for now short, collection! Where to look for information on programming with S4 system of classes and methods for R? Here is a open-ended collection of links to resources on learning programming in S4 system. Suggestions more than welcome!
 Books Articles and notes Presentation slides Links Packages Sometimes it is worthwhile to look at the source code of the available packages and learn from that. Here is are the packages that can be instructive: stats4, lme4. "	 0 Comments
GillespieSSA 0.5-1 is released	https://www.r-bloggers.com/2008/01/gillespiessa-0-5-1-is-released/	January 15, 2008	Mario Pineda-Krch	I just uploaded GillespieSSA 0.5-1 to CRAN. Now it’s just a matter of days before it has propagated itself across all CRAN mirrors. This version consists primarily of revisions I made in response to the reviewer comments on the paper where the package is introduced (submitted to the Journal of Statistical Software). There are some minor changes in the functionality of the ssa.plot() function but otherwise the changes consists entirely of buglet fixes and improvements to the documentation. One of the more interesting comments I got addressed the use of a character vector to pass the propensity functions to the wrapper function ssa(). For example, normally one would define the propensity functions for a logistic growth model as  This is the way it would be defined if the simulation is invoked using the higher level wrapper function ssa(). One can, however, also pass the propensity vector as a function by directly invoking the lower-level method function (ssa.d, ssa.btl, ssa.etl, ssa.otl, …). For the logistic growth model this could be done like so, The obvious advantage of this approach is that the propensity vector is simpler to define and maintain throughout the simulation. It is also likely that the simulation would run faster (or at least being simpler to optimize) without the extra over head imposed by the higher-level wrapper function. The disadvantage is that setting up the simulation is a tad more involved since one has to “manually” update the state vector, time variable and collect the output data (which, by the way, the above routine does not do).  Perhaps the most interesting consequence of directly invoking the lower-level method functions is that one now can vary the parameters of the model during the simulation allowing for temporal environmental heterogeneity, e.g. varying vital rates and carrying capacity over time. 	 0 Comments
Moving average/median	https://www.r-bloggers.com/2008/01/moving-averagemedian/	January 7, 2008	vikasrawal	?rollmean (package=zoo)?rollmedian (package=zoo)?runmed (package=stats) 	 0 Comments
Quantile regression in R	https://www.r-bloggers.com/2008/01/quantile-regression-in-r/	January 5, 2008	dataninja	Roger Koenker, a quantile regression crusader, has an R package that implements the procedure. It is called quantreg, and it is documented here. This package has apparently been around for quite some time, but I was only recently turned on to quantile regression, so it was under my radar. 	 0 Comments
Find type of variables in a data frame	https://www.r-bloggers.com/2008/02/find-type-of-variables-in-a-data-frame/	February 20, 2008	vikasrawal	sapply(a,class) gives type of field (character, numeric, or factor) for each variable in the data frame a. 	 0 Comments
A wraper function to convert coda files into a BUGS object	https://www.r-bloggers.com/2008/02/a-wraper-function-to-convert-coda-files-into-a-bugs-object/	February 11, 2008	Yu-Sung Su		 0 Comments
R graph with two y-axes	https://www.r-bloggers.com/2008/02/r-graph-with-two-y-axes/	February 4, 2008	Rob J Hyndman	I’ve been asked how to do this several times, so I thought it might help to put an example online.  	 0 Comments
Drop unused factor levels	https://www.r-bloggers.com/2008/02/drop-unused-factor-levels/	February 4, 2008	Forester		 0 Comments
R package: codetools	https://www.r-bloggers.com/2008/02/r-package-codetools/	February 4, 2008	Yu-Sung Su		 0 Comments
Paper on the Gillespie Stochastic Simulation Algorithm in press	https://www.r-bloggers.com/2008/02/paper-on-the-gillespie-stochastic-simulation-algorithm-in-press/	February 1, 2008	Mario Pineda-Krch	Just got news that my revisions to the reviewer’s comments on my paper GillespieSSA: Implementing the Gillespie Stochastic Simulation Algorithm in R were accepted. Hence, this paper is not officially in press in the Journal of Statistical Software.   Here’s the abstract: The deterministic dynamics of populations in continuous time are traditionally described using coupled, first-order ordinary differential equations. While this approach is accurate for large systems, it is often inadequate for small systems where key species may be present in small numbers or where key reactions occur at a low rate. The Gillespie stochastic simulation algorithm (SSA) is a procedure for generating time-evolution trajectories of finite populations in continuous time and has become the standard algorithm for these types of stochastic models. This article presents a simple-to-use and flexible framework for implementing the SSA using the high-level statistical computing language R and the package GillespieSSA. Using three ecological models as examples (logistic growth, Rosenzweig-MacArthur predator-prey model, and Kermack-McKendrick SIRS metapopulation model), this paper shows how a deterministic model can be formulated as a finite-population stochastic model within the framework of SSA theory and how it can be implemented in R. Simulations of the stochastic models are performed using four different SSA Monte Carlo methods: one exact method (Gillespie’s Direct method); and three approximate methods (Explicit, Binomial, and Optimized tau-leap methods). Comparison of simulation results confirms that while the time-evolution trajectories obtained from the different SSA methods are indistinguishable, the approximate methods are up to four orders of magnitude faster than the exact methods. A preprint is available on my Publication page. 	 0 Comments
Results of the St. Pat’s 10 Miler and 5K	https://www.r-bloggers.com/2008/03/results-of-the-st-pats-10-miler-and-5k/	March 23, 2008	Chris	Recently I ran the St. Pat’s 10 Miler in Atlantic City, Nj. It was my first official running event ever and I enjoyed it lot. Shortly after the race the official results have been posted on the Internet. The data did not only include the number and times of the participants but also gender and age. Looking at the finisher time distribution it shows that most runners finished at around 90 minutes:  How does age affect the finishing time?  The code to generate the images: 	 0 Comments
Plotting contours	https://www.r-bloggers.com/2008/03/plotting-contours/	March 18, 2008	Forester		 0 Comments
An Example for Just Another Gibbs Sampler (JAGS)	https://www.r-bloggers.com/2008/03/an-example-for-just-another-gibbs-sampler-jags/	March 4, 2008	Yu-Sung Su		 0 Comments
Writing Rd files in Vim	https://www.r-bloggers.com/2008/03/writing-rd-files-in-vim/	March 3, 2008	Michal	"I have made a small “translation” of a portion of “Writing R Extensions” manual about the Rd files to a vimhelp format. You can find it on vim.org, under this link http://www.vim.org/scripts/script.php?script_id=2177. If that does not work
just search for a script “rd” there. The script itself is called “rdhelp.txt”. "	 0 Comments
Ordered logistic model with varying intercepts (random effects)	https://www.r-bloggers.com/2008/03/ordered-logistic-model-with-varying-intercepts-random-effects/	March 2, 2008	Yu-Sung Su		 0 Comments
speed issue in R computing: apply() vs a loop	https://www.r-bloggers.com/2008/04/speed-issue-in-r-computing-apply-vs-a-loop/	April 23, 2008	Yu-Sung Su		 0 Comments
An R Wiki	https://www.r-bloggers.com/2008/04/an-r-wiki/	April 21, 2008	nsaunders	It’s been ages since I visited the R website, so I don’t know how long they’ve had a wiki.  It’s built using DokuWiki, one of my personal favourites. This is a great leap forward for R documentation, which is somewhat notorious for being (a) difficult to find and (b) difficult to understand when you find it.  If you’re a power R user and have a spare moment, please contribute. 	 0 Comments
The CDK/Metabolomics/Chemometrics Unconference results	https://www.r-bloggers.com/2008/04/the-cdkmetabolomicschemometrics-unconference-results/	April 7, 2008	Egon Willighagen		 0 Comments
Heteroscedasticity	https://www.r-bloggers.com/2008/04/heteroscedasticity/	April 6, 2008	vikasrawal	"If a model is estimated using the following code:
lm(y~x1+x2)->p 1. bptest(p) does the Breuch Pagan test to formally check presence of heteroscedasticity. To use bptest, you will have to call lmtest library. 2. If the test is positive (low p value), you should see if any transformation of the dependent variable helps you eliminate heteroscedasticity. Also check if the right hand side of the model is okay. 3. If 2 does not work, you can use the white’s heteroscedasticity-corrected covariance matrices to make inference. Package car has a function hccm that gives you the heteroscedasticity-corrected covariance matrix (there is a similar function in package sandwich also). coeftest(p,vcov=hccm(p)) will give you the results of the tests using this matrix. Use these results instead of summary(p). library(lmtest)
library(car)
bptest(p)
coeftest(p,vcov=hccm(p))
 Tags: GNU-R  "	 0 Comments
The disappearing mouse pointer…	https://www.r-bloggers.com/2008/05/the-disappearing-mouse-pointer/	May 31, 2008	[email protected]		 0 Comments
S3 vs S4, efficiency issues	https://www.r-bloggers.com/2008/05/s3-vs-s4-efficiency-issues/	May 23, 2008	Michal	While developing some new simulation code with S4 system I stumbled upon some big difficulties in terms of computational efficiency. That lead me to diging into archives of Rhelp and Rdevel looking for clues. I found some interesting threads that address almost exactly the same problems that I do. Read for yourself here and here, including the follow-ups by John Chambers and others. It is almost two years since I started to use S4 extensively for almost anything I develop in R. The transparency of the code and the ease of maintenance is so much greater in S4 than in S3. Not mentioning multiple inheritance, validity checks etc. Things seem to have improved since 2003 as this example, based on one of the posts mentioned above gave back then: So at least 3 times slower in S4 case. Now, on my P4 3.2Ghz, with R 2.7.0 gave  which is comparable. Nevertheless, I tried code profiling on my simulation and the output revealed that the majority of the CPU time was spent on method dispatch etc. so the difference might be still substantial. Right now my code works. Perhaps at some point I’ll port some portion to S3 and compare the results… 	 0 Comments
R2jags: A Package for Running jags from R	https://www.r-bloggers.com/2008/05/r2jags-a-package-for-running-jags-from-r/	May 21, 2008	Yu-Sung Su		 0 Comments
JAGS 1.0.2 is released	https://www.r-bloggers.com/2008/05/jags-1-0-2-is-released/	May 9, 2008	Martyn	JAGS 1.0.2 is now out. This is a patched release for the stable version, so there are no major changes in library functionality.   The major changes are: 	 0 Comments
Multiple Assignments or the Idiosyncrasies of R and SAS	https://www.r-bloggers.com/2008/05/multiple-assignments-or-the-idiosyncrasies-of-r-and-sas/	May 8, 2008	fernandohrosa	"Working on top of someone else’s code at work a couple of weeks ago I stumbled upon a piece of SAS code that went like this: Being raised in the land of open-source and having programmed in R since I was in college, that struck me at first as an implicit cast error, as check was previously declared integer. Or a misguided attempt to create an indicator variable. What surprised me even more was that not only there was no cast error as well as the code ran and gave a sensible result in the context of the program I was editing. If you still did not spot the weirdness of the statement above, try running the exact same piece of code in R (parenthesis added on purpose to return the result of the assignment): Now the explanation: due to the way assignments and comparison operators are defined across both languages, the same code in R will result in a Multiple Assignment, erasing the previous value of check and writing a character string over it, the same with Name, which will also be set to character. In SAS, where the = operator does assignments as well as comparisons (though one could argue that you could use the ‘eq’ mnemonic instead) the same expression evaluates if the CHAR variable Name is equal to the constant ‘Netter’, and the result of this logical expression (0 or 1) is then attributed to the check (NUMERIC) variable. Venables, W.N, Ripley, B. D. (2000) S Programming.
Slaughter, S.J., Delwiche, L. D. (2004) Little Sas Book.   "	 0 Comments
Error capture	https://www.r-bloggers.com/2008/05/error-capture/	May 6, 2008	Forester		 0 Comments
How to make SVN work on R-Forge and your local driver?	https://www.r-bloggers.com/2008/05/how-to-make-svn-work-on-r-forge-and-your-local-driver/	May 2, 2008	Yu-Sung Su		 0 Comments
Paper on GillespieSSA now published	https://www.r-bloggers.com/2008/05/paper-on-gillespiessa-now-published/	May 2, 2008	Mario Pineda-Krch	My paper on the GillespieSSA package has now been published in the latest volume of  Journal of Statistical Software. Check it out. 	 0 Comments
GGobi in Wikipedia	https://www.r-bloggers.com/2008/06/ggobi-in-wikipedia/	June 27, 2008	Di Cook	" GGobi now has an entry in  Wikipedia. Feel free to edit it!

 "	 0 Comments
Hack-at-it 2008	https://www.r-bloggers.com/2008/06/hack-at-it-2008/	June 27, 2008	Di Cook	The 2008 Hack-at-it was held June 22-23, just before Data Vis VI, in Bremen Germany. The main topics for the meeting were:  	 0 Comments
maps of Poland in R	https://www.r-bloggers.com/2008/06/maps-of-poland-in-r/	June 23, 2008	Michal	Bogdan Taranta (website in Polish) is developing a set of functions for drawing administrative maps of Poland. I wrote similar functionality for myself already some time ago, but only for voivodships, i.e. top-level administrative units, and also in a rather low resolution. Bogdan’s contribution seems to contain all levels, at high resolution, and including the regions’ capital cities and towns! I look forward to testing that! 	 0 Comments
Smart programming saves computing times	https://www.r-bloggers.com/2008/06/smart-programming-saves-computing-times/	June 21, 2008	Yu-Sung Su		 0 Comments
One R tip a day	https://www.r-bloggers.com/2008/06/one-r-tip-a-day/	June 21, 2008	Michal	I just encountered this website http://onertipaday.blogspot.com/: One R tip per day. Very nice collection of R tips. 	 0 Comments
Speed up R! Make R Run Faster!	https://www.r-bloggers.com/2008/06/speed-up-r-make-r-run-faster/	June 16, 2008	Yu-Sung Su		 0 Comments
Paper describing the weaver package published in Computational Statistics	https://www.r-bloggers.com/2008/06/paper-describing-the-weaver-package-published-in-computational-statistics/	June 14, 2008	seth	"It seems like a lifetime ago that I developed the weaver package for caching code chunks in Sweave documents.  The paper that I presented at the DSC 2007 has finally been published in Computational Statistics.  The title is Caching Code Chunks in Dynamic Documents: The weaver package.  Here’s the abstract: Authoring dynamic documents can become tedious for authors when a document contains one or more time consuming code chunks and each edit requires reprocessing all of the document. We introduce the weaver package that allows computationally expensive code chunks to be cached in order to speed up the edit/process/review cycle for dynamic documents authored using the Sweave framework.
 
And here a link to an unofficial pdf and the weaver package.
 Technorati Tags: Bioconductor, R  "	 0 Comments
Unmessing my pdfs.	https://www.r-bloggers.com/2008/06/unmessing-my-pdfs/	June 1, 2008	[email protected]		 0 Comments
R books	https://www.r-bloggers.com/2008/07/r-books/	July 30, 2008	Rob J Hyndman	 Amazon.com Widgets 	 0 Comments
How to Recover the Missing X(1) for the USL Scalability Model	https://www.r-bloggers.com/2008/07/how-to-recover-the-missing-x1-for-the-usl-scalability-model/	July 29, 2008	Neil Gunther		 0 Comments
download option price data from Yahoo	https://www.r-bloggers.com/2008/07/download-option-price-data-from-yahoo/	July 29, 2008	Quantitative Finance Collector		 0 Comments
Quantile Regression	https://www.r-bloggers.com/2008/07/quantile-regression/	July 29, 2008	Quantitative Finance Collector		 0 Comments
What is faster, Winbugs or Openbugs?	https://www.r-bloggers.com/2008/07/what-is-faster-winbugs-or-openbugs/	July 14, 2008	Andrew Gelman		 0 Comments
Guerrilla Data Analysis Class – Seats Still Available	https://www.r-bloggers.com/2008/07/guerrilla-data-analysis-class-seats-still-available/	July 14, 2008	Neil Gunther		 0 Comments
Get your R on	https://www.r-bloggers.com/2008/07/get-your-r-on/	July 14, 2008	dan	"useR! CONFERENCE, AUGUST 12-14 2008, DORTMUND GERMANY  
 Impressive statistical computing types like Andrew Gelman, Gary King, and others will be presenting at this year’s useR! conference. Decision Science News might just have to hop over and check it out. The program looks great. Those interested in learning R might be interested in our Decision Science News R tutorials one and two. About the Conference useR! 2008, the R user conference, takes place at the Fakultät Statistik, Technische Universität Dortmund, Germany from 2008-08-12 to 2008-08-14. Pre-conference tutorials will take place on August 11.
The conference is organized by the Fakultät Statistik, Technische Universität Dortmund and the Austrian Association for Statistical Computing (AASC). It is funded by the R Foundation for Statistical Computing. Following the successful useR! 2004, useR! 2006, and useR! 2007 conferences, the conference is focused on 1. R as the “lingua franca” of data analysis and statistical computing,
2. providing a platform for R users to discuss and exchange ideas how R can be used to do statistical computations, data analysis, visualization and exciting applications in various fields,
3. giving an overview of the new features of the rapidly evolving R project. As for the predecessor conference, the program consists of two parts: 1. invited lectures discussing new R developments and exciting applications of R,
2. user-contributed presentations reflecting the wide range of fields in which R is used to analyze data. A major goal of the useR! conference is to bring users from various fields together and provide a platform for discussion and exchange of ideas: both in the formal framework of presentations as well as in the informal part of the conference in Dortmund’s famous beer pubs and restaurants. Prior to the conference, on 2008-08-11, there are tutorials offered at the conference site. Each tutorial has a length of 3 hours and takes place either in the morning or afternoon. "	 0 Comments
UseR!2008 aftermath	https://www.r-bloggers.com/2008/08/user2008-aftermath/	August 30, 2008	Michal	Earlier in August I was on the R user conference which this year took place in Dortmund. It was a quite an exciting event gathering around 500 people from around the globe and featuring 170 presentations and talks. Topics varied from new developments in the R system, newly implemented statistical methods as well as plethora of very interesting, and often visually nice, applications. You can find the list of abstracts and also slides for majority of the talks on the conference’s website.  I left the conference, I’m sure similarly to others, with a wealthy bag of new R “tricks”. The next UseR is planned to take place next summer in Rennes (France). The website is already there. Among the available slides are the slides from my talk which was derived from my recent paper on coordination in dynamic social networks in heterogeneous groups. This talk focused on a computer simulation I performed for the paper. You can find the slides here. Additionally here (QuickTime, 37Mb) is a movie based on the simulation I describe there. More on the paper itself soon. 	 0 Comments
