title	link	date	author	text	comment_rbloggers
Power Analysis for mixed-effect models in R	https://www.r-bloggers.com/2009/09/power-analysis-for-mixed-effect-models-in-r/	September 18, 2009	toddjobe	"The power of a statistical test is the probability that a null
hypothesis will be rejected when the alternative hypothesis is true.
In lay terms, power is your ability to refine or “prove” your
expectations from the data you collect.  The most frequent motivation
for estimating the power of a study is to figure out what sample size
will be needed to observe a treatment effect.  Given a set of pilot
data or some other estimate of the variation in a sample, we can use
power analysis to inform how much additional data we should collect.
 
I recently did a power analysis on a set of pilot data for a long-term
monitoring study of the US National Park Service.  I thought I would
share some of the things I learned and a bit of R code for others that
might need to do something like this.  If you aren’t into power
analysis, the code below may still be useful as examples of how to use
the error handling functions in R (withCallingHandlers,
withRestarts), parallel programming using the snow
package, and linear mixed effect regression using nlme.  If you
have any suggestions for improvement or if I got something wrong on
the analysis, I’d love to hear from you.
 The study system was cobblebars along the Cumberland river in Big
South Fork National Park (Kentucky and Tennessee, United States).
Cobblebars are typically dominated by grassy vegetation that include
disjunct tall-grass prairie species.  It is hypothesized that woody
species will encroach onto cobblebars if they are not seasonally
scoured by floods.  The purpose of the NPS sampling was to observe
changes in woody cover through time.  The study design consisted of
two-stages of clustering: the first being cobblebars, and the second
being transects within cobblebars.  The response variable was the
percentage of the transect that was woody vegetation.  Because of
the clustered design, the inferential model for this study design
has mixed-effects.  I used a simple varying intercept
model:
 

 
where y is the percent of each transect in woody vegetation sampled
n times within J cobblebars, each with K transects.  The
parameter of inference for the purpose of monitoring change in woody
vegetation through time is β, the rate at which cover changes as
a function of time.  α, γ, σ2γ, and
σ2y are hyper-parameters that describe the hierarchical
variance structure inherent in the clustered sampling design.
 
Below is the function code used I used to regress the pilot data.  It
should be noted that with this function you can log or logit transform
the response variable (percentage of transect that is woody).  I put
this in because the responses are proportions (0,1) and errors should
technically follow a beta-distribution.  Log and logit transforms with
Gaussian errors could approximate this. I ran all the models with
transformed and untransformed response, and the results did not vary
at all.  So, I stuck with untransformed responses:
 
Here are the results from this regression of the pilot data:
 When I decided upon the inferential model the first thing that
occurred to me was that I never learned in any statistics course I
had taken how to do such a power analysis on a multi-level model.
I've taken more statistics courses than I'd like to count and taught
my own statistics courses for undergrads and graduate students, and
the only exposure to power analysis that I had was in the context of
simple t-tests or ANOVA.  You learn about it in your first 2
statistics courses, then it rarely if ever comes up again until you
actually need it.
 
I was, however, able to find a great resource on power analysis from
a Bayesian perspective in the excellent book ""Data Analysis Using
Regression and Multilevel/Hierarchical Models"" by Andrew Gelman and
Jennifer Hill.  Andrew Gelman has thought and debated about power
analysis and you can get more from his blog.  The approach in the
book is a simulation-based one and I have adopted it for this
analysis.
 For the current analysis we needed to know three things: effect
size, sample size, and estimates of population variance. We set
effect size beforehand.  In this context, the parameter of interest
is the rate of change in woody cover through time β, and
effect size is simply how large or small a value of β you want
to distinguish with a regression.  Sample size is also set a   priori. In the analysis we want to vary sample size by varying the
number of cobblebars, the number of transects per cobblebar or the
number of years the study is conducted.  
 
The population variance cannot be known precisely, and this is where
the pilot data come in.  By regressing the pilot data using the
model we can obtain estimates of all the different components of the
variance (cobblebars, transects within cobblebars, and the residual
variance).  Below is the R function that will return all the
hyperparameters (and β) from the regression:
 
To calculate power we to regress the simulated data in the same way we
did the pilot data, and check for a significant β.  Since
optimization is done using numeric methods there is always the chance
that the optimization will not work.  So, we make sure the regression
on the fake data catches and recovers from all errors.  The solution
for error recovery is to simply try the regression on a new set of
fake data.  This function is a pretty good example of using the R
error handling function withCallingHandlers and
withRestarts.
 
To calculate the power of a particular design we run
fakeModWithRestarts 1000 times and look at the proportion of
significant β values:
 
Finally, we want to perform this analysis on many different sampling
designs.  In my case I did all combinations of set of effect sizes,
cobblebars, transects, and years.  So, I generated the appropriate designs:
 
Once we know our effect sizes, the different sample sizes we want,
and the estimates of population variance we can generate simulated
dataset that are similar to the pilot data.  To calculate power we
simply simulate a large number of dataset and calculate the
proportion of slopes, β that are significantly different from
zero (p-value < 0.05).  This procedure is repeated for all the
effect sizes and sample sizes of interest. Here is the code for
generating a simulated dataset. It also does the work of doing the
inverse transform of the response variables if necessary.
 
Then I performed the power calculations on each of these designs.  This
could take a long time, so I set this procedure to use parallel processing
if needed.  Note that I had to re-~source~ the file with all the
necessary functions for each processor.
 
The output of the powerAnalysis function is a data frame with
columns for the power and all the sample design settings.  So, I wrote
a custom plotting function for this data frame:
 
Below is the figure for the cobblebar power analysis.  I won't go into
detail on what the results mean since I am concerned here with
illustrating the technique and the R code.  Obviously, as the number of
cobblebars and transects per year increase, so does power.  And, as
the effect size increases, observing it with a test is easier.
 

  Author: Todd Jobe

  Date: 2009-09-18 Fri HTML generated by org-mode 6.30trans in emacs 22 "	 0 Comments
Web-Based Multilevel Modeling	https://www.r-bloggers.com/2009/09/web-based-multilevel-modeling/	September 18, 2009	jebyrnes	This is tremendously cool.  A nice intuitive web-based interface for the lme4 package in R (and you neither need to know R or understand the intricacies of the lme4 package) that gives you pdf output and plots.  If you just want to play around and not worry about coding things up, it’s a great little option.  Be sure to check out the demo video. 	 0 Comments
Set your R working directory in TextWrangler	https://www.r-bloggers.com/2009/09/set-your-r-working-directory-in-textwrangler/	September 18, 2009	[email protected]		 0 Comments
R Community in Australia	https://www.r-bloggers.com/2009/09/r-community-in-australia/	September 17, 2009	Jeromy Anglim		 0 Comments
Workflow in R	https://www.r-bloggers.com/2009/09/workflow-in-r/	September 17, 2009	Rob J Hyndman	This came up recently on StackOverflow. One of the answers was particularly helpful and I plan to adopt this for my future work. In fact, it is close to what I already do, but is a little more structured. The idea is to break the code into four files, all stored in your project directory. These four files are to be processed in the following order. It is a good idea to save your workspace after each file is run. There are many advantages to this set up. First, you don’t have to reload the data each time you make a change in a subsequent step. Second, if you come back to an old project, you will be able to work out what was done relatively quickly. It also forces a certain amount of structured thinking in what you are doing, which is helpful. Often there will be bits and pieces of code that you write, but don’t end up using, yet don’t want to delete. These should either be commented out or saved in files with other names. All analysis from reading data to producing the final results should be reproducible by simply source()ing these four files in order with no further user intervention. 	 0 Comments
Example 7.12: Calculate and plot a running average	https://www.r-bloggers.com/2009/09/example-7-12-calculate-and-plot-a-running-average/	September 17, 2009	Nick Horton		 0 Comments
Comments on “Introduction to Scientific Programming and Simulation Using R”	https://www.r-bloggers.com/2009/09/comments-on-introduction-to-scientific-programming-and-simulation-using-r/	September 17, 2009	Jeromy Anglim		 0 Comments
R clinic this week: Regression Modeling Strategies in R	https://www.r-bloggers.com/2009/09/r-clinic-this-week-regression-modeling-strategies-in-r/	September 16, 2009	Stephen Turner		 0 Comments
Multiple Linear Regression	https://www.r-bloggers.com/2009/09/multiple-linear-regression/	September 14, 2009	rtutor.chiyau	"

A multiple linear regression (MLR) model that describes a dependent variable
y by independent variables x1, x2, …, xp (p > 1) is expressed by the equation as
follows, where the numbers α and βk (k = 1, 2, …, p) are the parameters, and ϵ is the
error term.
    read more "	 0 Comments
Find the function you’re looking for in R	https://www.r-bloggers.com/2009/09/find-the-function-youre-looking-for-in-r/	September 14, 2009	Stephen Turner		 0 Comments
Chicago Half Marathon 2009	https://www.r-bloggers.com/2009/09/chicago-half-marathon-2009/	September 13, 2009	Thinking inside the box	"

As for the race itself, I didn’t run it quite as evenly as I had hoped, faded
a little around mile ten and eleven and came in at 1:34:54, or just under
7:15 min/mile.  Not a bad time—I have done better (e.g.
last year)
but also worse. All in all still one my very favourite races, and this year
with a once-again improved course that featured even more running along the 
lake. I will probably be back next year.

 "	 0 Comments
Finding an R function	https://www.r-bloggers.com/2009/09/finding-an-r-function/	September 13, 2009	Rob J Hyndman	"Suppose you want a function to fit a neural network. What’s the best way to find it? Here are three steps that help to find the elusive function relatively quickly. First, use help.search(""neural"") or the shorthand ??neural. This will search the help files of installed packages for the word “neural”. Actually, fuzzy matching is used so it returns pages that have words similar to “neural” such as “natural”. For a stricter search, use help.search(""neural"",agrep=FALSE). The following results were returned for me (using the stricter search). If you want to look through packages that you have not necessarily installed, you could try using the findFn function in the sos package. This function searches the help pages of packages covered by the RSiteSearch archives (which includes all packages on CRAN). For example returns 206 matches (on 13 September 2009) from over 60 packages. These are ordered based on a relevance score, so the top few packages on the list are probably the most useful. (There’s a good discussion of findFn here.) To look even further afield, use RSiteSearch(""neural"") which will send your search to R site search. As well as CRAN packages, this covers the  R-help mailing list archives, help pages, vignettes and task views. Still no luck? Try Rseek.org. It’s a restricted Google search covering on R-related sites. Finally, if all else fails, try asking a question on StackOverflow (make sure your question is tagged with “r”),  or send your question to the R-help mailing list. Both usually solicit replies in under an hour. However, don’t do this without first trying to find the function using one of the other methods. "	 0 Comments
New R package: sos	https://www.r-bloggers.com/2009/09/new-r-package-sos/	September 12, 2009	romain francois	Searching help pages of contributed packages just got easier with the release of the new sos package. This is a replacement for and substantial enhancement of the existing “RSiteSearch” package.  To learn more about it, try vignette(“sos”) We hope you find this as useful as we have. Spencer Graves, Sundar Dorai-Raj, Romain Francois 	 0 Comments
Aggregating SSURGO Data in R	https://www.r-bloggers.com/2009/09/aggregating-ssurgo-data-in-r/	September 10, 2009	dylan	" 
Premise
SSURGO is a digital, high-resolution (1:24,000), soil survey database produced by the USDA-NRCS. It is one of the largest and most complete spatial databases in the world; and is available for nearly the entire USA at no cost. These data are distributed as a combination of geographic and text data, representing soil map units and their associated properties. Unfortunately the text files do not come with column headers, so a template is required to make sense of the data. Alternatively, one can use an MS Access template to attach column names, generate reports, and other such tasks. CSV file can be exported from the MS Access database for further use. A follow-up post with text file headers, and complete PostgreSQL database schema will contain details on implementing a SSURGO database without using MS Access.  If you happen to have some of the SSURGO tabular data that includes column names, the following R code may be of general interest for resolving the 1:many:many hierarchy of relationships required to make a thematic map.  
This is the format we want the data to be in 
 
So we can make a map like this
 read more "	 0 Comments
Machine Learning in R	https://www.r-bloggers.com/2009/09/machine-learning-in-r/	September 10, 2009	Stephen Turner		 0 Comments
brew: Creating Repetitive Reports	https://www.r-bloggers.com/2009/09/brew-creating-repetitive-reports/	September 9, 2009	learnr	"United Nations report World Population Prospects: The 2008 Revision (highlights available here) provides data about the historical and forecasted population of the country. In exploring the future and past population trends it is relatively easy to subset the dataset by your selected variable. Likewise, it is straightforward to produce a 263 page pdf-file that shows the population trend between 1950 – 2005 for all the countries in the dataset. However, if one would like to create a report showing some summary tables and graphs along with some textual description for all the countries, then the process becomes more complicated. This is exactly what the brew() package written by Jeffrey Horner was designed to help the users with. brew “implements a templating framework for mixing text and R code for report generation” and makes it very easy to generate repetitive reports which is of great help for example in performing exploratory analysis on a large dataset with many variables.  
 The report-generation can be split into three parts: Data preparation script is saved in the popreportdata.R file which is later sourced into the brew template. In fact I would like to explore the data by continent rather than by country, so in order to do this the first step is to group the countries by continent with the help of Isocodes package that contains standard country or area codes and geographical regions used by UN. countries dataframe contains now regional classification for each country. Next step is to merge a subset of this information with the population data. In this step the graphs are saved to the disk using ggsave, and a list of lists with four dataframes about each continent is returned. My report template is essentially a latex document which includes an R code loop wrapped in brew syntax. To make it easier to generate the latex statements for inclusion of graphs and tables, a few helper functions are defined first. Brew syntax is really very simple to use. From the help file: The resulting pdf-file can be seen here "	 0 Comments
search the graph gallery from R	https://www.r-bloggers.com/2009/09/search-the-graph-gallery-from-r/	September 8, 2009	romain francois	This is a short code snippet that is motivated by this thread on r-help yesterday. The gallery contains a search engine textbox (top-right) that can be used to search for content in the website using either its internal crude search engine or perform a google search restricted to the gallery.  Here we write a small R function that can be used to take advantage of the search engine, from R 	 0 Comments
new R package : ant	https://www.r-bloggers.com/2009/09/new-r-package-ant/	September 8, 2009	romain francois	The ant package has been released to CRAN yesterday. As discussed in previous posts in this blog (here and here), the ant R package provides an R-aware version of the ant build tool from the apache project.  The package contains an R script that can be used to invoke ant with enough plumbing so that it can use R code during the build process. Calling the script is further simplified with the ant function included in the package.  The simplest way to take advantage of this package is to add it to the Depends list of yours, include a java source tree somewhere in your package tree (most likely somewhere in the inst tree) with a build.xml file, and include a configure and configure.win script at the root of the package that contains something like this:  This will be further illustrated with the demo package helloJavaWorld in future posts 	 0 Comments
Comparison between 15 different cities…	https://www.r-bloggers.com/2009/09/comparison-between-15-different-cities/	September 6, 2009	the R user...		 0 Comments
RQuantLib 0.3.0 Windows build snag	https://www.r-bloggers.com/2009/09/rquantlib-0-3-0-windows-build-snag/	September 6, 2009	Thinking inside the box		 0 Comments
RQuantLib 0.3.0 released	https://www.r-bloggers.com/2009/09/rquantlib-0-3-0-released/	September 5, 2009	Thinking inside the box	"

This version, the first in a new ‘0.3.*’ release series, contains all the
work that Khanh Nguyen did during his Google Summer of Code participation
which I had mentioned a while
back and for which I acted as mentor.

 

And Khanh did great. We now have a lot more Fixed Income
functionality; I include the full ChangeLog entry below.  I also added some
simple calendaring support and the odd fix here or there while mentoring.
All of this had been available while technically ‘in progress’ thanks to
support provided by the R-Forge project
hosting where SVN checkouts as well as nightly binaries are provided.
A few more details are on the 
RQuantLib page
and I hope to add a few more examples.

 
As promised, the ChangeLog entry:

 "	 0 Comments
Polynomial regression techniques	https://www.r-bloggers.com/2009/09/polynomial-regression-techniques/	September 5, 2009	Todos Logos		 0 Comments
R Flashmob	https://www.r-bloggers.com/2009/09/r-flashmob/	September 4, 2009	Tal Galili	"Today I noticed a call for R users to gather around a single campfire for one hour and share their questions and answers. The campfire name is stackoverflow.com, a site dedicated for handling programming questions. The event details are bellow: 
 From: The R Flashmob Project
Subject: R Flashmob #2 You are invited to take part in R Flashmob, the project that makes the
world a better place by posting helpful questions and answers about the
R statistical language to the programmer’s Q & A site stackoverflow.com Please forward this to other people you know who might like to join. FAQ Q. Why would I want to join an inexplicable R mob? A. Tons of other people are doing it. Q. Why else? A. Stackoverflow was built specifically for handling programming questions.
It’s a better mousetrap. It offers search (and is well indexed by search engines),
tagging, voting, the ability to choose the “best” answer to a question, and the ability to
edit questions and answers as technology progresses. It has a karma system to
reward people who are happy to help and discourage MLJs (mailing list jerks). Q. Do the organizers of this MOB have any commercial interest in stackoverflow? A. None at all. We’re just convinced it is the best way to help and promote R. All
the content submitted to stackoverflow is protected by a Creative Commons
CC-Wiki License, meaning anyone is free to copy, distribute, transmit, and
remix the information on stackoverflow. All the content on stackoverflow is
regularly made available for download by the public. INSTRUCTIONS – R MOB #2
Location: stackoverflow.com
Start Date: Tuesday, September 8th, 2009
Start Time:
10:04 AM – US Pacific
11:04 AM – US Mountain
12:04 PM – US Central
1:04 PM – US Eastern
6:04 PM – UK
7:04 PM – Continental W. Europe
5:04 AM (Weds) – New Zealand (birthplace of R)
Duration: 50 minutes (1) At some point during the day on September 8th, synchronize your watch to
http://timeanddate.com/worldclock/personal.html?cities=137,75,64,179,136,37,22 (2) The mob should form at precisely 4 minutes past the hour and not beforehand. (3) At 4 minutes past the hour, you should arrive at stackoverflow.com, log in,
and post 3 R questions. Be sure to tag the questions “R”. See the posting
guidelines at http://stackoverflow.com/faq to understand what makes a good
question. (4) Follow R Flashmob updates at http://twitter.com/rstatsmob (5) Post twitter messages tagged #rstats and #rstatsmob during the mob,
providing links to your questions. (6) During the R MOB, you can chat with other participants on the #R channel
on IRC (freenode). To do this, install the Chatzilla extension on Firefox.
Click “freenode” on the main screen. Then type /join #R in the field at the
bottom of the screen. Then chat. (7) If you finish posting your three questions within the 50 minutes, stick
around to answer questions and give “up votes” to good questions and answers. (8) IMPORTANT: After posting, sign the R Flashmob guestbook at
http://bit.ly/6F8B2 (9) Return to what you would otherwise have been doing. Await
instructions for R MOB #3. This invitation already gained exposure from 3 blogs: I am waiting to see who else will join the fun. "	 0 Comments
ClipPath copies filename and path from windows for loading into R	https://www.r-bloggers.com/2009/09/clippath-copies-filename-and-path-from-windows-for-loading-into-r/	September 4, 2009	Stephen Turner		 0 Comments
R Flashmob #2	https://www.r-bloggers.com/2009/09/r-flashmob-2/	September 4, 2009	Paolo		 0 Comments
