title	link	date	author	text	comment_rbloggers
R Design Flaws #1 and #2:  A Solution to Both?	https://www.r-bloggers.com/2008/08/r-design-flaws-1-and-2-a-solution-to-both/	August 25, 2008	Radford Neal	I’ve previously posted about two design flaws in R. The first post was about how R produces reversed sequences from a:b when a>b, with bad consequences in “for” statements (and elsewhere).  The second post was about how R by default drops dimensions in expressions like M[i:j,] when i:j is a sequence only one long (ie, when i equals j). In both posts, I suggested ways of extending R to try to solve these problems.   I now think there is a better way, however, which solves both problems with one simple extension to R.  This extension would also make R programs run faster and use less memory. Recall the problems, and the solutions I proposed previously… To stop sequences from reversing, we need a new operator to use rather than 1:n, which suffers from the reversal problem when n is zero (which can’t be changed for compatibility reasons).  I suggested 1:>:n.  To stop dimenions from being dropped, I suggested using semicolons rather than commas to separate subscripts. My new suggestion is that in the most common case where the indexing vector is a sequence, we could use the same new operator introduced to solve the reversing problem — ie, we write M[1:>:n,] to get the first n rows, and define it so that the result isn’t converted to a vector when n is one. Now, this may seem like it won’t work.  If 1:>:n returns a vector, then when n is one, it’s a vector of length one, which has to (by default) lead to the dimension being dropped if ordinary subscripting by scalars is to work (since scalars in R are really vectors of length one). The solution is for 1:>:n to not return a vector, but instead return a new data type that just records its two operands.  This new data type — perhaps it could be called an indexing pair — would have to be recognized by “for” statements and by the subscripting operator.  A dimension indexed by such an indexing pair would never be dropped.  One could add an operator :: for the ascending indexing pair operator (but it unfortunately has no obviously mnemonic descending counterpart). One disadvantage of this solution is that it doesn’t address the dropped dimension problem in the general case where the vector index may not be a sequence.  But indexing by an ascending sequence is by far the most common case, so having to write drop=FALSE for the others may be OK.  (However, perhaps knowledge of the drop=FALSE option would be less common if it is needed less often.) Similary, this solution doesn’t address the problem of reversing sequences outside the context of for loops and subscripting, but those are the most common uses. One extra advantage of introducing indexing pairs is that they will take up a trivial amount of storage.  In contrast, if you use 1:1000000 to iterate a million times in a for loop, R will allocate 4 Megabyes of storage to hold this sequence.  Producing this sequence also takes time, of course.  It would be possible for R to avoid this cost when using 1:1000000 in a for loop, by treating this combination specially, but it doesn’t (in version 2.4.1 at least): Notice how the memory usage goes up by 3.9 Megabytes during the for loop. Another extra advantage of introducing :>: (or ..) is that the precedence of this operator could be made lower than that of any other operator (with no loss, since an indexing pair wouldn’t be a valid operand for any other operator).   Expressions like 1:>:n-1 would then do what the programmer meant (unlike 1:n-1). So, does anyone see any flaws in this solution? 	 0 Comments
More stats sites	https://www.r-bloggers.com/2008/08/more-stats-sites/	August 20, 2008	John Johnson		 0 Comments
Visualize Copulas	https://www.r-bloggers.com/2008/08/visualize-copulas/	August 20, 2008	Quantitative Finance Collector		 0 Comments
Design Flaws in R #2 — Dropped Dimensions	https://www.r-bloggers.com/2008/08/design-flaws-in-r-2-%e2%80%94-dropped%c2%a0dimensions/	August 19, 2008	Radford Neal	"In a comment on my first post on design flaws in the R language, Longhai remarked that he has encountered problems as a result of R’s default behaviour of dropping a dimension of a matrix when you select only one row/column from that dimension.   This was indeed the design flaw that I was going to get to next!  I think it also points to what is perhaps a deeper design flaw. I’ll give a toy example of the problem, which shows up regularly in real (but more complicated) contexts.  Consider the following function, whose arguments are a matrix X and a vector s of column indexes, and which returns a vector containing the  Euclidean norm of each row of X, looking only at columns in s: Here’s an example of its use: Perhaps it would be interesting to see how the norms get smaller as we drop leading dimensions: Oops…  When the loops gets to where k has the value 4, the subset k:4 contains just one dimension.  When R comes to evaluating X[,s], it doesn’t return a matrix with one column, but rather a vector.  The apply function doesn’t work on vectors, so we get an error message rather than the answer. There’s a fix.  The “["" operator takes a ""drop""argument, which defaults to TRUE, giving the behaviour above, but which can be explicitly set to FALSE to disable conversion from a matrix to a vector in these circumstances.  If we modify the function as follows: We get the right answers: There are two problems with this fix.  One is that in some programs, one needs to put drop=FALSE in numerous places, making the code rather hard to read.  The more serious problem, and what makes this a real design flaw, is that writing code without drop=FALSE is so much easier that it's often left out even when it is needed.  Indeed, since the errors typically occur only for extreme cases, it's easy for the programmer to not realize there's a problem. (As an aside, this is another context where the reversing sequences problem arises — if n is 0, subset.norms2(M,1:n) should produce all zeros, but doesn't, not because of a bug in subset.norms2 but because 1:0 doesn't produce the empty sequence.) Can we solve the dimenion dropping problem by just changing the default for drop from TRUE to FALSE?  Of course not, since this would break too many existing programs.  But even if backward compatibility weren't a problem, this wouldn't be a good solution, since the times when we want drop to be TRUE are even more numerous than when we want it to be FALSE. Look at the following, for instance: If drop defaults to FALSE, ordinary subscripting with single indexes for both dimensions will give a 1x1 matrix!  Now, R will treat matrices as vectors (and scalars) as needed in many contexts, but propagating a dim attribute (what marks something as a matrix) all over the place will sooner or later cause problems. What can be done at this point?  I'm not sure.  The best idea I can come up with is to let subscripts be separated by semicolons as well as commas, with use of a semicolon signaling that drop will be FALSE.  In other words, M[i;j] would be equivalent to M[i,j,drop=FALSE], but much more concise.  People could start using the semicolon whenever they're not trying to extract single elements, without breaking old programs. The root cause of the dropped dimension problem seems to be that R does not have scalars.  Instead, what looks like a scalar is actually a vector of length one.  To R, there is no difference between M[2,3] and M[2:2,3:3].  So there's no way for the first of these to drop dimensions and the second to retain them. It's probably hopeless to try to change now, but I think it would have been better for scalars to be treated as vectors or converted to vectors as necessary, without pretending that they're always vectors.  Not having real scalars may seem like a unification or simplification, but it just creates problems.  These start with the first thing a new user sees on trying R out, which is likely to be something like this: Good.  R knows how to add 2 and 2.  But what's the ""[1]"" doing there? "	 0 Comments
High-performance computing in R at useR! 2008	https://www.r-bloggers.com/2008/08/high-performance-computing-in-r-at-user-2008/	August 12, 2008	Mario Pineda-Krch	The useR! 2008 meeting is about to commence. Although I am not able to go this year I will be keeping a close eye on the talks and slides that (I assume) will be posted.  Last years useR! meeting (which I attended) was a great experience and considering the list of participants for this years meeting, it is bound to be a very interesting meeting. Dirk Eddelbuettel has already posted the slides to his talk entitled “Introduction to High-Performance R” on his web site. Clearly, anyone using R on, say, computer clusters would find this highly relevant.  On a side note, it would be interesting to have some idea of how commonly R is used on computer clusters. I have been using R on our in-house cluster for a few years now, and although it may sound a bit counterintuitive to run a high-level interpreted language such as R in a high-performance computing environment such as a cluster (most people would use a low-level compiled language like C for example), using R has the big advantage of allowing very fast prototyping. In other words, although the R code runs slower on the cluster than native C code would do it takes much less time to code it. Of course, for certain classes of models there is no other option that using C (or a similar low-level language), but if you can get away with R, a cluster allows you to run your serial code (or parallelized R code) in parallel with potentially huge time savings.  This is from the “Mario’s Entangled Bank” blog ( http://pineda-krch.com ) of Mario Pineda-Krch, a theoretical biologist at the University of California, Davis. 	 0 Comments
Updated version of GGobi: 2.1.8	https://www.r-bloggers.com/2008/08/updated-version-of-ggobi-2-1-8/	August 12, 2008	Hadley Wickham		 0 Comments
Process Simulation in R	https://www.r-bloggers.com/2008/08/process-simulation-in-r/	August 12, 2008	Quantitative Finance Collector		 0 Comments
R-code for Vasicek estimation	https://www.r-bloggers.com/2008/08/r-code-for-vasicek-estimation/	August 8, 2008	Quantitative Finance Collector		 0 Comments
Link C with R	https://www.r-bloggers.com/2008/08/link-c-with-r/	August 7, 2008	Yu-Sung Su		 0 Comments
Design Flaws in R #1 — Reversing Sequences	https://www.r-bloggers.com/2008/08/design-flaws-in-r-1-%e2%80%94-reversing%c2%a0sequences/	August 6, 2008	Radford Neal	"The R language for statistical computing has become the standard for academic statistical research, for the very good reason that it’s better than the alternatives.  It’s far from perfect however.  I could come up with a long “wish list” of desired  features it lacks, but that’s not what I’ll do in this series of posts.  Instead, I’ll concentrate on real design flaws — aspects of the language that make it all too easy to write unreliable programs.  Many of these are inherited from R’s predecessors, S and S-Plus, and may even originate in the very earliest version of S, which was seen more as a calculator than as a programming language. By far the most commonly-encountered design flaw in R is in the “:” operator for producing sequences, whose most common use is in “for” statements. Here’s an example: This approximates a definite integral by summing up the areas of n trapezoids defined using a grid of n+1 points from a to b. The area of one trapezoid is the width of its base, (b-a)/n, times the average of the heights of its two side, (f(left)+f(right))/2, where left and right are adjacent grid points. The function f is used twice at every grid point except for the very first and very last. To avoid wasting time, the program evaluates f only once at these n-1 middle points. This is handled by the “for” loop. I’ve avoided a minor design flaw in R here, by using 1 : (n-1) to define the range of values for j in the loop, which should be 1, 2, …, n-1.  Beginning R programmers usually write 1:n-1, and only find out after hours of debugging that this is interpreted as (1:n)-1, and so produces the sequence 0, 1, …, n-1.  But at least they usually realize they have a bug. The main problem is far more insidious.  The program above works fine, as long as n is greater than 1.  And it usually is, since you usually want to approximate the integral using more than one trapezoid, if you’re interested in getting an accurate result.  But n=1 is an entirely valid value, and sooner or later will come up, perhaps when a user cares more about speed than accuracy, or perhaps when another program automatically chooses this value of n for some reason.  Here’s an illustration of what happens: The exact answer is 63.  Even using n=2, one gets pretty close.  But 202.5 when using n=1?  The correct value for the approximation using one trapezoid is 3 x (32+62)/2 = 67.5. What’s happened?  Well, when n=1, the sequence 1 : (n-1) defining the range in the “for” statement is 1:0. Rather than interpreting this as the empty sequence, R decides that you must have wanted a sequence of decreasing values, namely 1 and 0.  So the body of the “for” loop is done twice, rather than not at all, with the unfortunate result seen above. Automatically reversing the direction of the sequence p:q when p>q must have seemed like a convenience to the original designers, who probably had in mind the situation where this expression is typed in directly by a user, who knows whether p>q or p. It’s a terrible idea in a programming language, however. Almost always, the logic of the program will require either an increasing sequence or a decreasing sequence, not one direction some times and the other direction other times.  And in many programs, the empty sequence will be needed as a valid limiting case, and of course is never generated with automatic reversal. Now, it clearly is possible to write working programs despite this design flaw.  For a sequence starting at 1, seq(length=n) will work.  You might think that seq(1,n,by=1) would also work, but instead it produces an error message when n=0.  You can also use an “if” statement to bypass the “for” loop when it shouldn’t be done, as below: Unfortunately, all these solutions are more work to write, and harder to read.  It’s much easier to write programs that don’t guard against problems of reversing sequences (which crop up in places other than “for” loops too).  The result is programs that mostly work, most of the time. Can this flaw in R be fixed?  At this point, changing the specification of the “:” operator is impossible — it would invalidate too many existing programs.  New operators could be introduced, however. For example, “:>:” could generate an increasing sequence, with a:>:b producing the empty sequence if a>b.  Similarly, “:” and “
         


Related
ShareTweet




To leave a comment for the author, please follow the link and comment on their blog:  Radford Neal's blog » R Programming.

R-bloggers.com offers daily e-mail updates about R news and tutorials about learning R and many other topics. Click here if you're looking to post or find an R/data-science job.

Want to share your content on R-bloggers? click here if you have a blog, or  here if you don't.
 "	 0 Comments
Welcome to FOSS Trading	https://www.r-bloggers.com/2008/09/welcome-to-foss-trading/	September 28, 2008	Joshua Ulrich	"
 "	 0 Comments
Group-level variances and correlations	https://www.r-bloggers.com/2008/09/group-level-variances-and-correlations/	September 23, 2008	Yu-Sung Su		 0 Comments
Design Flaws in R #3 — Zero Subscripts	https://www.r-bloggers.com/2008/09/design-flaws-in-r-3-zero-subscripts/	September 21, 2008	Radford Neal	Unlike the two design flaws I posted about before (here, here, and also here), where one could at least see a reason for the design decision, even if it was unwise, this design flaw is just  incomprehensible.  For no reason at all that I can see, R allows one to use zero as a subscript without triggering an error.  (Remember that in R, indexes for vectors and matrices start at one, not zero.) This is of course a terrible decision, because it makes debugging harder, and makes it more likely that bugs will exist that have never been noticed. So what does R do with a zero subscript, seeing as it’s meaningless?  It just ignores it, which is possible because it views all numeric subscripts as vectors, that extract or replace a set of elements, not necessarily just one.   So R simply removes all zeros from a vector used as a subscript, producing a shorter vector. Here’s what happens (with the current version of R, 2.7.2): Contrast this with what happens when you use a subscript that is too large: Extending vectors automatically when an assignment is made beyond the end can obviously be useful (though it might be wiser not to).  Returning NA when extracting an element beyond the end is also a sensible action (though signalling an error immediately might be more useful for debugging). And negative subscripts are usefully defined as referring to their complement. But what possible use is there for ignoring zero subscripts rather than signalling an error? It’s perhaps belabouring the obvious, but let me explain that signalling an error when a zero subscript is used is desirable because this is a very common sort of program bug.  It can easily arise when a program is scanning backwards through the vector elements, and goes one step too far.  It can also easily arise when data is initialized to zeros, with the intent to replace the zeros with something sensible later, but actually some zeros are never replaced. The way R behaves when zero is used as a subscript when replacing elements is particularly bad, since doing nothing at all can easily lead to an apparently working program that produces wrong answers.  (The behaviour of returning an empty vector when zero is used as a subscript when extracting an element is more likely to produce an error later on, so that at least the problem will be evident.) So what should be done?  That’s easy — change R so that use of zero as a subscript produces an immediate error.  That’s trivial to do (mixing positive and negative subscripts produces an immediate error now, so the apparatus for it must be there).  Might that break some existing programs?  Yes, it will.  But 99.9% of those programs are already broken.  The users just don’t know it, thinking that the answers they get are correct when they’re not.  The remaining 0.1% of these broken programs were written by really stupid programmers who thought that exploiting an obscure and unwise feature in order to produce a really hard-to-understand program was a good idea.  It wasn’t. Along with this, R should be changed so that using NA as a subscript when replacing elements in a vector also produces an error.  What to do with NA subscripts used to extract elements is a little bit harder to decide, but it seems to me that something about the following is a bit funny: 	 0 Comments
pmin and pmax	https://www.r-bloggers.com/2008/09/pmin-and-pmax/	September 16, 2008	R Tips	Did you know that there are multiple versions of the min and max function.  make sure that you are using the right one.  pmin and pmax are the ‘parallel’ versions of the min and max function, meaning that they can take vector arguments and return vectors back.  Much better than setting up your own apply function.  So make sure that you are using the right version. read more 	 0 Comments
Highlights from useR!	https://www.r-bloggers.com/2008/09/highlights-from-user/	September 11, 2008	Leslie Hawthorn		 0 Comments
rgraph6 on R-Forge	https://www.r-bloggers.com/2008/09/rgraph6-on-r-forge/	September 4, 2008	Michal	I have moved my rgraph6 R package to R-Forge. R-Forge is a website that facilitates development of R packages by providing services for version control (through Subversion), automatic checking and building of the packages including binaries for Windows and MacOS, as well as for collaboration with other R users/developers. The rgraph6 package has been already available through my private mini-repository. It provides an interface to a pretty compact format for storing undirected graphs as sequences of printable ASCII characters which is quite useful for handling large libraries of undirected graphs. The format itself is due to Brendan McKay. The detailed description of it is available here and is also included within the rgraph6 package. Two crucial functions of the package are written in C. As my knowledge of C is rather low it might be far from perfect. If you know C well you are more than welcome to have a look at the sources and suggest some improvements. I believe that one of the crucial things is checking for the size of the character sequences that are converted to binary numbers and then to decimal. I’m not sure whether it will work for arbitrary network sizes. I plan to put a public advertisement on R-Forge to look for people who would be willing to do that. Actually that was one of the reasons I opened the package development to others through R-Forge. So don’t be shy and go ahead!   From now on I will not release any future version of rgraph6 through this website. All will be distributed through rgraph6‘s website on R-Forge. The older versions will still be available though. You can install the current version from R-Forge directly from R with: 	 0 Comments
evolutionary algorithm optimization	https://www.r-bloggers.com/2008/09/evolutionary-algorithm-optimization/	September 4, 2008	Quantitative Finance Collector		 0 Comments
How do you measure a major league slugger?	https://www.r-bloggers.com/2008/09/how-do-you-measure-a-major-league-slugger/	September 1, 2008	mike	" I gave a talk last month at SAP Labs in Palo Alto, along with Jim Porzak of ResponSys, introducing the R Statistical Language to a Business Intelligence interest group.  The goal was to highlight how open source tools, like R, can be used to build predictive models.  The example I gave centered around baseball and a simple question:  how do you measure a baseball slugger? Michael Lewis, in  Moneyball , described how the baseball analyst Bill James was frustrated by the fact that major league hitters were consistently rated by their batting averages.  James wrote:   “a hitter should be measured by his success in that which he is trying to do, … create runs. It is startling, when you think about it, how much confusion there is about this.” – Bill James, 1979 Baseball Abstract However, since teams create runs, not batters, the only way to connect batting statistics with runs is to use team averages.  The idea is that if we know which statistics predict runs at the team level, these statistics could be used to measure individual hitters. I decided to test the value of three batting statistics myself — batting average, slugging percentage, and OPS (on-base plus slugging) — and see how well they predicted team runs, using MLB team data for the years 2000-2005 (available from baseball-databank.org). The results are shown in the three scatter plots below, and no surprise, Bill James is right:  a team’s overall batting average (top-most chart) is a comparatively poor predictor of how many runs it will score in an average game.  Slugging percentage (middle plot) is a slightly better predictor, and OPS (bottom plot) is the best of the three statistics I looked at:  it has a 0.95 correlation with runs scored (the r shown in the upper right corner of the plots is the Pearson correlation coefficient, the red lines represent least-squares fits to the points).

I highlighted a couple of interesting outliers in the top batting average plot: teams that achieved a high level of scoring with a comparatively low team batting average.  Who were these teams?  None other than Billy Beane’s 2000 and 2001 Oakland Athletics.  This suggests that the As management may have found excess value in fielding players who — despite having slightly lower batting averages — were capable of generating runs. These results show what Bill James and others already know:  that a baseball slugger should not be measured by his batting average, but by OPS or other hybrid statistics that best correlate with his success at generating runs.  There is nothing novel about the results of my analysis.  But what I hope is novel is showing how it can be done using open source tools (R and MySQL), free data (baseball-databank.org), and a few lines of code ( sabermetrics using R page).  "	 0 Comments
Plotting Math in R	https://www.r-bloggers.com/2008/10/plotting-math-in-r/	October 29, 2008	Yu-Sung Su		 0 Comments
The most popular programming languages in 2008	https://www.r-bloggers.com/2008/10/the-most-popular-programming-languages-in-2008/	October 26, 2008	Yu-Sung Su		 0 Comments
Working with directories	https://www.r-bloggers.com/2008/10/working-with-directories/	October 24, 2008	R Tips	"Something quite annoying to me is when I get an R script and I have to change all of the file references in the script. I get something like this this:


source(""C:\\Documents and Settings\\UserName\\Data\\...\\File1.R"")

data<-read.table(""C:\\Documents and Settings\\UserName\\Data\\...\\SomeData.dat"")


Besides these being unsightly, file references are also a pain to change.  Usually I just delete all but the filename.  How can I get away with that? because R remembers what directory you are dealing with and makes all file references relative. so the above becomes:
 read more "	 0 Comments
