title	link	date	author	text	comment_rbloggers
Rmetrics – Basics of Option Valuation	https://www.r-bloggers.com/2008/10/rmetrics-basics-of-option-valuation/	October 22, 2008	Quantitative Finance Collector		 0 Comments
What I’ll be presenting at O’Reilly Money Tech 2009	https://www.r-bloggers.com/2008/10/what-ill-be-presenting-at-oreilly-money-tech-2009/	October 21, 2008	mike	" (April 2009 Update:  Unfortunately, The Money Tech Conference was indefinitely postponed, but fortunately I will be presenting a version of this talk in July at OSCON 2009). I’ve been invited to speak at O’Reilly’s Money Tech conference this coming February 4-6th in New York City and thought I’d share the abstract for my talk here.  I’ll likely be in New York for several days, if you’d like to get together to chat about data drop me a line! My talk is entitled “Open Source Analytics: Visualization and Predictive Modeling of Big Data with the R Programming Language”
 ABSTRACT Just as the explosion of online data catalyzed the development of
storage technologies such as Hadoop, new challenges in data analytics
– turning terabytes into actionable insights — demand new tools.  R,
an open-source language for statistical computing and graphics, is an
extensible, embeddable, and industry-strength solution for analytics.
In this session, I showcase R’s power by building predictive models
for Brazilian soybean harvests and baseball slugger salaries. DESCRIPTION The economics of data aggregation and analysis are being disrupted by
falling costs for storage and CPU power, the continuing shift of
business processes online, and the deluge of data that is being
generated as a consequence. Satellite images, SEC filings, supply chain data (RFID data streams),
online prices, and newsgroup content represent just a few of the data
sources that hold potential for predictive modeling of markets. Much of this data does not fit within existing paradigms for business
analysis: either its size overwhelms traditional desktop tools such as
Excel, or else its unique dimensions (such as geocodes) prevent its
being pipelined into more powerful, but narrowly designed, analysis
tools.  Finally, closed-source tools cannot keep pace with the leading
edge of innovation in statistical and machine-learning algorithms. Enter the open source programming language R.  R has been dubbed the
lingua franca for statistical computing and graphical analysis, with a
pedigree tracing back several decades at Bell Labs.  Though its
million-plus users are concentrated within academia, R is gaining
currency within several high-profile quantitative analysis groups,
including Google’s Customer Insights team and Barclays Global
Investors.  In addition, R’s extensibility via user-contributed
packages has spawned an active developer community. In this session, I will focus on applying R’s powerful visualization
tools to guide the construction of predictive models, using the kind
of large, multidimensional data sets that increasingly confront
quantitative analysts.  Along the way, I will highlight R’s packages
for inferential statistics, its compact modeling syntax, and its ease
of connectivity with persistent data stores. The two specific examples I will discuss are: – an analysis of NASA’s Landsat imagery of Brazil’s center-west
agricultural regions to detect correlates for soybean harvest yields,
and a derived predictor of the Brazilian soybean market based in part
on these correlates. – a validation of Bill James’ sabermetrics approach to batting
performance using 30 years of Major League Baseball statistics, and a
derived predictor for batters’ salaries. For all of its strengths, R has an admittedly steep learning curve.
While source code for the examples will be provided online, this talk
will emphasize techniques and working examples over technical details.
The goal of this session is to give quantitative analysts the courage
to invest in learning the R language, by showcasing R’s power,
highlighting its features, and providing examples of its use for
innovative applications. "	 0 Comments
Another solution to the R to Word table problem	https://www.r-bloggers.com/2008/10/another-solution-to-the-r-to-word-table-problem/	October 17, 2008	John Johnson	You'll need the package svViews (part of the SciViews series of packages) for this one. Basically, what the above does is create a temporary file to hold the RTF document, then write the RTF code to recreate the table, then add the RTF file to Word. The table can then be manipulated as desired. Unfortunately, as the SciViews is Windows only, the automation part of this process is Windows only, but the file creation is not. Since myfile is a string variable, an R function can be written to execute a series of Applescript commands on the Macintosh. 	 0 Comments
Using R in consulting: playing nice with Microsoft Word	https://www.r-bloggers.com/2008/10/using-r-in-consulting-playing-nice-with-microsoft-word/	October 17, 2008	John Johnson		 0 Comments
Time series packages on R	https://www.r-bloggers.com/2008/10/time-series-packages-on-r/	October 16, 2008	Rob J Hyndman	There is now an official CRAN Task View for Time Series. This will replace my earlier list of time series packages for R, and provide a more visible and useful entry point for people wanting to use R for time series analysis. If I have missed anything on the list, please let me know. 	 0 Comments
Econometric tools for performance and risk analysis	https://www.r-bloggers.com/2008/10/econometric-tools-for-performance-and-risk-analysis/	October 13, 2008	Quantitative Finance Collector		 0 Comments
R’s working directory	https://www.r-bloggers.com/2008/10/r%e2%80%99s-working-directory/	October 3, 2008	Michal	"
Do you usually start R with a desktop icon or some other shortcut? Are you tired of using setwd and getwd each time after you start R to get the working directory correctly? If so, then your days of suffering might be just coming to an end.
 
Having the working directory set correctly is very convenient. You can both read and write files to the proper place without typing (on Windows, usually very long) path names. There are couple of solutions:
 
One way to achieve this is to have a setwd function call at the top of your scripts. You then run it every time you do the computations in that script. For example to have at the top of a file a following line:
 
It is a nice approach, but things get complicated if you move files to different computers, say from home to your office, and have different directory structures, disk names etc. Of course you can change it every time. Or perhaps keep couple of versions and have all of them but one commented, for example:
 
Which is also OK, but for me is too much micromanagement. Also, it becomes a problem if the script is not intended for interactive use.
 
An alternative might be work with Windows shortcuts for starting R. In shortcut’s properties there is a “Start in” field in which you can put the path to the desired folder. If you start R with the modified icon then R’s working directory will be correctly set. With that approach you can have, say, couple of R icons on your desktop, each to different project folders.
 
This is convenient unless you work on 10 projects. Each time you may have to create yet another shortcut.
 
Another approach is to set the environment PATH variable. If you add the path to R’s executable to it then you will be able to start R from whatever directory in the system you want.
 
To modify the PATH variable you need to right-click on “My Computer” and select “Properties” then go to “Advanced” tab and “Environment variables” button. The way to modify the PATH variable depends on where you installed R. Usually it is something like c:program filesRR 2.7.0bin.
 
I use this approach myself with Total Commander and its command line. Wherever I am on the disk I can start R in that directory just bu typing rgui and pressing Enter. You can also use Windows Console (cmd) for that.
 
Yet another way is to add a command to your context menu (the one appearing when you right-click on things). By right-clicking on a folder and choosing “R” option you can start R with that folder set as the working directory.
 
To set up such a command you have to modify Windows Registry and will require, I believe, administrative privileges. Look here for details how to do this.
 
Any other ideas or suggestions? "	 0 Comments
First and easy steps with R and Sweave	https://www.r-bloggers.com/2008/11/first-and-easy-steps-with-r-and-sweave/	November 28, 2008	:)-k		 0 Comments
Sweave.sh plays with cacheSweave	https://www.r-bloggers.com/2008/11/sweave-sh-plays-with-cachesweave/	November 26, 2008	Gregor Gorjanc		 0 Comments
Calculating an N50 from Velvet output	https://www.r-bloggers.com/2008/11/calculating-an-n50-from-velvet-output/	November 25, 2008	Jeremy Leipzig		 0 Comments
Use anchoring to lose years off your age	https://www.r-bloggers.com/2008/11/use-anchoring-to-lose-years-off-your-age/	November 21, 2008	Diego		 0 Comments
Setting up Textmate to use R	https://www.r-bloggers.com/2008/11/setting-up-textmate-to-use-r/	November 21, 2008	:)-k		 0 Comments
Plot symbols in R	https://www.r-bloggers.com/2008/11/plot-symbols-in-r/	November 18, 2008	Yu-Sung Su		 0 Comments
Call C from R and R from C	https://www.r-bloggers.com/2008/11/call-c-from-r-and-r-from-c/	November 17, 2008	Forester		 0 Comments
Multivariate dependence with copulas	https://www.r-bloggers.com/2008/11/multivariate-dependence-with-copulas/	November 17, 2008	Quantitative Finance Collector		 0 Comments
Sweave Engine for TeXShop	https://www.r-bloggers.com/2008/11/sweave-engine-for-texshop/	November 17, 2008	cameron	Sweave is an awesome utility for including the output of R code in a LaTeX document which I have started using regularly. TeXShop is my favorite editor/viewer for LaTeX under Mac OS X for many reasons. One of which is the speed of the edit -> compile -> view process which it enables.  Therefore, I have been reluctant to use Sweave in the past because of the extra LaTeX compilation step that is not supported by default in TeXShop. Recently, my friend Charlie Sharpsteen first showed me this way to get around this with a custom “engine”. The engine file looke like this: Sweave.engine  Place this file in ~/Library/TeXShop/Engines/, make sure PATH includes the location of you TeX distribution. Make sure executable permissions (like 744) are set on both files or TeXShop will give an error message.  Now open (or re-open) TeXShop and select “Sweave” from the list at the top left.  Now you can use command-t to compile Sweave and view your document in one step! Thanks Chuck!  	 0 Comments
Using the booktabs package with Sweave and xtable	https://www.r-bloggers.com/2008/11/using-the-booktabs-package-with-sweave-and-xtable/	November 16, 2008	cameron	The xtable package in R can output R data as latex tables. Used in conjunction with Sweave it is possible to automatically generate tables in a report.  Needless to say this provides a really appealing possibility of never typing data into a table again.  The only problem is that I think the default latex tables don’t look that great. Enter booktabs… The booktabs package in latex makes really nice tables, especially if there is math in your table that might run up against the regular \hline in the tabular environment. Buried away in the xtable documentation are some options that make this possible.  See the example below:  To compile, Sweave needs to be run on it.  Running Sweave is an pre-processing step in the latex compilation process  and then check out your awesome new table that you didn’t type!  	 0 Comments
R function to reverse and complement a DNA sequence	https://www.r-bloggers.com/2008/11/r-function-to-reverse-and-complement-a-dna-sequence/	November 13, 2008	fabiomarroni	"Warning!!
This post is intended for documentation only. I would like to remind everyone (me in first place!) that the comp() function of the (seqinr) package can complement a DNA sequence, and rev() function of Rbase can reverse a character vector. Using a combination of the two you can reverse, complement, and reverse complement sequences as well.  Complements (and eventually reverse) a DNA sequence, which has to be inserted as a character vector, no matter if lower or uppercase.
Limitations:
1) Cannot work with RNA, only DNA
2) Cannot reverse without complementing. You can complement and reverse complement, but not just reverse.Author Fabio Marroni (http://www.fabiomarroni.altervista.org/)
Arguments:
x:character vector, the DNA sequence.
rev: logical. If TRUE, the function will return the reverse complemente, if FALSE, it will return the complementary sequence. The default value is TRUE. Value:
The complemented (and eventually reverse) sequence, as a character vector. There are several web sites which can easily complement and reverse a DNA sequence (and RNA as well).
The advantage of using this piece of code is that it is possible to automatically reverse complement a series of sequences: I had several primers to reverse/complement and I didn’t want to copy and paste them every time. Only now I found a web site in which you can copy and paste the primers on different lines and get the reverse complement of each primer on a different lines. You may want to try it: http://arep.med.harvard.edu/cgi-bin/adnan/revcomp.pl.
However, the versatility of R allows you to automatically retrieve the reverse complement and (for example) save each of the primer in a different text file.
Also, there is a nice library in R (seqinr) which can reverse complement and perform several other tasks (http://cran.r-project.org/web/packages/seqinr/index.html). Since my R programming skills are “limited”, comments and suggestions are welcome!
  Thanks to rhi for providing code for complementing without reversing. I paste it below.  "	 0 Comments
Modeling Financial Time Series with S-PLUS	https://www.r-bloggers.com/2008/11/modeling-financial-time-series-with-s-plus/	November 12, 2008	Quantitative Finance Collector		 0 Comments
Saving a Workspace	https://www.r-bloggers.com/2008/11/saving-a-workspace/	November 11, 2008	R Tips	R will can save the users workspace at the end of a session so that he can take it up again where he left off. I personally don’t like doing this but there are times when one would want to save their work, especially after complex and time consuming computations. read more 	 0 Comments
Quantitative Risk Management R package	https://www.r-bloggers.com/2008/11/quantitative-risk-management-r-package/	November 5, 2008	Quantitative Finance Collector		 0 Comments
R/Finance 2009: Applied Finance with R	https://www.r-bloggers.com/2008/12/rfinance-2009-applied-finance-with-r/	December 30, 2008	Joshua Ulrich	"
 "	 0 Comments
New stuff in the gdata R package	https://www.r-bloggers.com/2008/12/new-stuff-in-the-gdata-r-package/	December 30, 2008	Gregor Gorjanc		 0 Comments
RQuantLib 0.2.10	https://www.r-bloggers.com/2008/12/rquantlib-0-2-10/	December 29, 2008	Thinking inside the box		 0 Comments
Rcpp now in Debian	https://www.r-bloggers.com/2008/12/rcpp-now-in-debian/	December 25, 2008	Thinking inside the box		 0 Comments
High-Performance Computing with R	https://www.r-bloggers.com/2008/12/high-performance-computing-with-r/	December 25, 2008	Gregor Gorjanc		 0 Comments
Very flattering	https://www.r-bloggers.com/2008/12/very-flattering/	December 24, 2008	Thinking inside the box		 0 Comments
Statistics for Neuroscience (Neuroscience 9506b)	https://www.r-bloggers.com/2008/12/statistics-for-neuroscience-neuroscience-9506b/	December 23, 2008	Paul Gribble		 0 Comments
gdata gains trimSum function	https://www.r-bloggers.com/2008/12/gdata-gains-trimsum-function/	December 20, 2008	Gregor Gorjanc		 0 Comments
Rtools and Cygwin on MS Windows	https://www.r-bloggers.com/2008/12/rtools-and-cygwin-on-ms-windows/	December 20, 2008	Gregor Gorjanc		 0 Comments
Extra moments measure	https://www.r-bloggers.com/2008/12/extra-moments-measure/	December 16, 2008	Quantitative Finance Collector		 0 Comments
R matrices in C functions	https://www.r-bloggers.com/2008/12/r-matrices-in-c-functions/	December 13, 2008	Forester		 0 Comments
Memory limit management in R	https://www.r-bloggers.com/2008/12/memory-limit-management-in-r/	December 13, 2008	Gregor Gorjanc		 0 Comments
Functions for portfolio analysis	https://www.r-bloggers.com/2008/12/functions-for-portfolio-analysis/	December 11, 2008	Quantitative Finance Collector		 0 Comments
Convert Splus to R	https://www.r-bloggers.com/2008/12/convert-splus-to-r/	December 10, 2008	Quantitative Finance Collector		 0 Comments
Computational Finance with R	https://www.r-bloggers.com/2008/12/computational-finance-with-r/	December 5, 2008	Joshua Ulrich	"
 "	 0 Comments
Some of my other R-resources	https://www.r-bloggers.com/2008/12/some-of-my-other-r-resources/	December 5, 2008	:)-k		 0 Comments
